"If passed, a new law would help save local news;Curbing Facebook and Google's power:",,2019-11-17T00:00:00Z,U.S. Federal; New Jersey,,News,946,want ability control content compensate fairly content critic industry analyst even news publication sound alarm prediction suppose imminent demise local journalism make weekly basis sometimes fight future news seem winnable view one way forward ensure long term sustainability quality journalism get well deal big tech platform ability control content protect poach major platform like facebook google dominate online ecosystem industry need ability collectively negotiate platform represent big hope help member congress side aisle journalism competition preservation act 2019  introduce house senate organization represent news media alliance one bill chief advocate pass bill would allow publisher four year antitrust safe harbor collectively negotiate tech platform well business term around news content share monetize online news media industry long struggle balance need financial security mission provide public vital information society world today face striking irony news consumption high today ever publisher revenue steadily decline large part unbalanced relationship news publisher tech platform major tech platform try say safe harbor bill preserve old business model news false narrative misdirection bill fight digital future news content world two company absolutely control online ecosystem google facebook access billion user allow set rule publisher engage audience content display prioritize monetize market dominance allow control news since act middleman reader publisher capture valuable consumer datum use sell advertising broaden distance content provider consumer cause deterioration publisher reader relationship also reward low quality click bait high quality journalism unfortunately single publisher power stand tech platform take back revenue relationship rightfully however power number antitrust safe harbor bill would allow us use number improve situation grant publisher ability collectively negotiate platform congress would recognize imbalance power help level playing field favorable term tech platform would allow earn subscription advertising dollar ow back publisher protect preserve public right access quality news parameter include bill ensure negotiation would strictly benefit news consumer news publisher large one publisherswe ask tech platform regulate see immense value online experience reader want ability control content compensate fairly content remain thriving vital component american democracy without access high quality journalism everyone suffer include tech platform news medium know politician stand issue impact us extreme weather event affect community local business community among many thing facebook mark zuckerberg twitter jack dorsey google co founder sergey brin larry page rely news much reader help make decision business unlike average reader decision make outsized impact business well news content quality publisher always always drive consumer late medium whether follow news day radio television computer smartphone unless publisher give opportunity get fair return product establish real relationship audience nothing value news consumer find small local publisher currently defenseless tech platform journalism competition preservation act attack platform would offer shield defend publisher unfairly overpower join force industry hope build relationship need tech platform order continue provide quality information public secure fair deal platform future news risk future civic society editor note piece originally appear october 2019 issue crain news pro turn david chavern guest columnistphoto illustration luis solano usa today network getty imageswhat want ability control content compensate fairly content,Asbury Park Press (New Jersey)
"If passed, a new measure would help save local news",,2019-11-23T00:00:00Z,U.S. Federal; Maryland,,News,899,critic industry analyst even news publication sound alarm prediction suppose imminent demise local journalism make weekly basis sometimes fight future news seem winnable view one way forward ensure long term sustainability quality journalism get well deal big tech platform ability control content protect poach major platform like facebook google dominate online ecosystem industry need ability collectively negotiate platform represent big hope help member congress side aisle journalism competition preservation act 2019  introduce house senate organization represent news media alliance one bill chief advocate pass bill would allow publisher four year antitrust safe harbor collectively negotiate tech platform well business term around news content share monetize online news media industry long struggle balance need financial security mission provide public vital information society world today face striking irony news consumption high today ever publisher revenue steadily decline large part unbalanced relationship news publisher tech platform major tech platform try say safe harbor bill preserve old business model news false narrative misdirection bill fight digital future news content world two company absolutely control online ecosystem google facebook access billion user allow set rule publisher engage audience content display prioritize monetize market dominance allow control news since act middleman reader publisher capture valuable consumer datum use sell advertising broaden distance content provider consumer cause deterioration publisher reader relationship also reward low quality click bait high quality journalism unfortunately single publisher power stand tech platform take back revenue relationship rightfully however power number antitrust safe harbor bill would allow us use number improve situation grant publisher ability collectively negotiate platform congress would recognize imbalance power help level playing field favorable term tech platform would allow earn subscription advertising dollar ow back publisher protect preserve public right access quality news parameter include bill ensure negotiation would strictly benefit news consumer news publisher large one publisherswe ask tech platform regulate see immense value online experience reader want ability control content compensate fairly content remain thriving vital component american democracy without access high quality journalism everyone suffer include tech platform news medium know politician stand issue impact us extreme weather event affect community local business community among many thing facebook mark zuckerberg twitter jack dorsey google co founder sergey brin larry page rely news much reader help make decision business unlike average reader decision make outsized impact business well news content quality publisher always always drive consumer late medium whether follow news day radio television computer smartphone unless publisher give opportunity get fair return product establish real relationship audience nothing value news consumer find small local publisher currently defenseless tech platform journalism competition preservation act attack platform would offer shield defend publisher unfairly overpower join force industry hope build relationship need tech platform order continue provide quality information public secure fair deal platform future news risk future civic society editor note piece originally appear october 2019 issue crain news pro turndavid chavernguest columnist,"Daily Times (Salisbury, Maryland)"
"If passed, a new measure would help save local news",,2019-11-17T00:00:00Z,U.S. Federal; Delaware,,News,607,critic industry analyst even news publication sound alarm prediction suppose imminent demise local journalism make weekly basis sometimes fight future news seem winnable view one way forward ensure long term sustainability quality journalism get well deal big tech platform ability control content protect poach major platform like facebook google dominate online ecosystem industry need ability collectively negotiate platform represent big hope help member congress side aisle journalism competition preservation act 2019  introduce house senate organization represent news media alliance one bill chief advocate pass bill would allow publisher four year antitrust safe harbor collectively negotiate tech platform well business term around news content share monetize online news media industry long struggle balance need financial security mission provide public vital information society world today face striking irony news consumption high today ever publisher revenue steadily decline large part unbalanced relationship news publisher tech platform bill fight digital future news content world two company absolutely control online ecosystem google facebook access billion user allow set rule publisher engage audience content display prioritize monetize market dominance allow control news since act middleman reader publisher capture valuable consumer datum use sell advertising broaden distance content provider consumer cause deterioration publisher reader relationship also reward low quality click bait high quality journalism however power number antitrust safe harbor bill would allow us use number improve situation grant publisher ability collectively negotiate platform congress would recognize imbalance power help level playing fieldwe ask tech platform regulate see immense value online experience reader want ability control content compensate fairly content remain thriving vital component american democracy without access high quality journalism everyone suffer include tech platform news medium know politician stand issue impact us extreme weather event affect community local business community among many thing join force industry hope build relationship need tech platform order continue provide quality information public secure fair deal platform future news risk future civic society turndavid chavernguest columnist,"The News Journal (Wilmington, Delaware)"
"If technology is going to take over our lives, it needs to be a bit more considerate;As computers start to watchour every move, driveour cars, controlour heating, even constructour reality,thepromise to respect and protect our privacy is not just nice, but necessary, says Andrew Griffin",Andrew Griffin,2019-01-14T00:00:00Z,U.S. Federal; International,,News,1071,2018 year learn hate tech then2019 must year hope winus back might seem recently industry give aspiration revolutionise knowledge communication instead focus sow disinformation monetise private life blame finally change world scale proponent promise well new year begin company define response challenge seem unlikely large tech company rise fall time soon likely point time moment thing change define image technology industry 2018 glitzy product launch flashy new feature facebook boss mark zuckerberg dodge question congress cambridge analytica scandal  duck dodge question us congress outright avoid parliament twitter ceo go holiday myanmar country ravage genocide expert say enable social medium apparently unable contain child sex abuse image platform ban nudity destroy many vibrant community sign let 2019 least effort police bad behaviour might start effect company begin realise regulation matter much instance ask regulation facial recognition software develop us government even notoriously regulation averse facebook seem realise would accept eventually read morefor democracy sake politician need get tough tech giantssuch rule important technology reach even far life already move desk pocket wrist 2019 could seep even glass house car anywhere else let anything caution facebook content simply social media platform huge screen camera video chatting emerge time series datum abuse scandal serve highlight risk give big tech control life portal receive torrent criticism confusion product strange look limited feature eventually entirely obscure simple fact company criticised everything track around web create product facebook satirise regardless whether portal good product damage already product like amazon alexa pave way voice technology take centre stage 2019  flip side sometimes look little perverse refuse collect datum user happy hand difficult link decision relative weakness product siri yet spin move ethical one company ceo tim cook argue human right make sense give hard see technological economic benefit time decision appear smart one technology go take even intimate place life watch every move drive car control house even construct reality promise hoover datum time nice necessary apple already access personal information heart rate rumour work everything glass kind intimacy require trust even company commit use datum conscientiously like amazon alexa voice assistant dog fear nsa bad give trust tech company must prove worthy let personal life must respect protect privacy money spend voice power tech ever privacy could important smart tech make wrong bet technology virtual reality fail take voice assistant avoid fate must focus convince us useful trustworthy read morehas future smart home tech arrivedwill amazon deliver demand smart home future housing smart home could allow house spy youit might turn killer feature much feature lack year concern addiction social medium smartphone reach peak come movement could change understanding product entirely bring thoughtful approach way use apple google even facebook allow user monitor limit block app entirely get much feature introduce midst finding show phone social medium turn way keep us use stop us use sometimes cut edge speaker piece furniture  voice power could one way around way interact computer helpful without make us feel helpless powerful without take away power ambient disappear background life rather make us disappearit something recognise company like smart speaker firm market cutting edge technology like furniture reliable way cut screen time seem get rid screen knewhowever arrive successful product 2019 sure make us use device less well less escape life improve,The Independent (United Kingdom)
"If there are new rules, Big Tech will write them;Silicon Valley claims that it welcomes regulation but is lobbying aggressively to prevent it, writes Danny Fortson in San Francisco",Danny Fortsonin,2020-02-02T00:00:00Z,U.S. Federal; International,,News,1148,something strange happen silicon valley tech tycoon ask nay plead regulate alphabet sundar pichai say month artificial intelligence important govern new law join microsoft satya nadella say davos europe general data protection regulation  industry fight tooth nail fantastic start hope america would soon emulate even facebook mark zuckerberg pine new rule write last year law maker often tell much power speech frankly agree list area would invite sensible regulation range privacy ensure integrity election block harmful content 35year old billionaire munich month discuss framework new rule regulation internet european politician public plea crackdown however odd different dynamic unfolding behind scene big tech launch fierce wellfunded campaign stamp crackdown entirely bad craft rule could fact tighten stranglehold understand force play look far lobby dollar amazon run world rich person jeff bezos pointedly join pro regulation chorus last year grab throne america top corporate lobbyist lavish 168  15 team 100 washington accord federal datum compile centre responsive politics second facebook spend 167 71 lobbyist top spender 2018 google parent alphabet drop ninth spend 127 centre sarah bryner say five year ago company essentially nothing lobby universe perhaps surprising ramp influence operation justice department federal trade commission open competition investigation big four amazon apple facebook alphabet google house judiciary committee launch investigation presidential candidate elizabeth warren bernie sanders make break big tech central campaign industry get ahead come wave sensible however much simply try educate politician try stop anything carl szabo general counsel netchoice one tech aggressive lobbyist whose member include google facebook twitter yahoo spend time beat back two argument tech company big break section 230 liability shield fuel rise need scrap section 230 communications decency act pass 1996 10 americans britons internet access hand immunity website content post user cornerstone empire build facebook google twitter rest allow sell ad worth hundred billion dollar post make user without concern could hold liable post might promote political misinformation self harm terrorist propaganda hany farid digital forensic professor university california berkeley call gift god unprecedented liability protection presidential candidate joe biden say last month section 230 revoke idea social medium platform could sue appear website would clean szabo however say logic faulty section 230 say simply codify another concept know conduit immunity establish nearly 70 year case law section 230 go away big tech argue immunity remain another mechanism end day section 230 produce good least harm say szabo empower company police content facebook example 30000 post moderator without fear legal reprisal shape key battleground szabo say industry would stand unison effort touch section 230 farid testify congress big tech failing last year say industry lobbyist say want bipartisan support reform 230 everybody acknowledge absurd according industry source american politician consider borrow britain law set go effect year would impose duty care platform even allow civil suit company fail protect user list harm range pornography cyber bullying area focus szabo call break big tech giant power full display last week facebook hit record profit reveal astound 29 billion people use app every month amazon report good three month ever apple amazon zoom stock price add 13bn bezos fortune day szabo eye catch figure distraction reality none company fit legal definition monopoly america mean company use power harm consumer facebook example quarter global advertising market google third amazon account roughly half e commerce transaction lap walmart overall sale apple niche seller luxury tech product one fifth global smartphone sale rest dominate google android analytical perspective look whether case make antitrust fail every single time aside declaration big say szabo actually look fact think government come conclusion pretty soon benedict evans independent tech analyst say shift world many people silicon valley start understand search engine message platform tool systemically important part western society backroom washington brussels westminster issue hammer one thing certain plea silicon valley fine new law seem business look leadership know rule follow say szabo mistake demand clear consistent rule demand increase regulation end day section 230 produce good least harm,The Sunday Times (London)
"If the Tech Oligarchs Can't Beat the Bad Press, They'll Just Buy it",,2018-04-11T00:00:00Z,U.S. Federal; California,,News,1544,apr 11 2018  oligarch putative tech master universe face unprecedented criticism leave  right reason extend wanton privacy invasion people describe facebook mark zuckerberg  dumb fk president trump  typically hyperbolic assault amazon success tax avoidance public  far still disdain tech oligarch wall street energy firm clearly threaten politically wallet seemingly unstoppable hold capital market also start slip somewhat investor begin worry potential decline social medium well technical failure undermine value company like uber tesla  snapchat oligarch change way without coercion mark zuckerberg amid uproar still seem determined block privacy protection california  elsewhere facebook arrogance even incite tension tech overlord apple tim cook  assault mark zuckerberg privacy violation fact cook beijing world capital advanced surveillance make public spanking ever bizarre like medium buy yet even net worth drop bit tech oligarch enough money subtly change conversation one primary way buy financially stressed medium particularly print side tech money recent year buy venerable institution new republic importantly washington post put world rich man charge one nation influential newspaper recently laurene powell left lean  widow late steve jobs  scoop atlantic nonprofit compete traditional competitor still sadly make money perhaps important move google also promote journalism robot invest 300 million  subsidize favor reporter give generally poor condition  business allure many scribbler fat beef shank would hungry dog progressive might cheer concerned privacy consider company former executive chairman eric schmidt  tell cnbcif something want anyone know maybe first place tech control medium agenda oligarch leveraged buyout journalism could shape news decade come equally rapacious mogul early 20th century like mccormicks  chicago william randolph hearst buy paper push agenda imperial expansion anti unionism resistance assault fortune current crop mogul also ideology politic gentry liberalism include promotion dense urbanism  open border heap portion identity politic like forebear want keep money embrace quasi libertarian refusal address danger pose concentration wealth power notably provide patina fairness oligarch may try find ally among libertarian conservative  count never oppose malefactor conservative view sensitive social issue kevin williamson find go far reservation less room provide anything associate grassroot base populism whether trumpian version bernie sanders jeff bezos might detest trump recall 2016 turn gun bernie whose policy might threaten enormous wealth corporate power republic peril internet seem invite expand access ever widen scope content creator digitization appear hyper concentrate medium  geographically coast pipeline control overwhelmingly  firm like facebook  google guardian  recently put exxonmobil attempt insert every element life like might concerted grassroots movement curb influence ironically brouhaha russian effort influence election may provide oligarch license curate accurately censor view like part censorship  carry guidance develop largely progressive group  like southern poverty law center often label anyone outside ideological safe space racist bigot consider hateful speech politically correct reflect neo nazi putin inspire opinion meanwhile restraint equally noxious voice left ultimately tech mogul follow approach describe late radical social thinker c wright mills power elite remain constrain debate way threaten core interest oligarch unprecedented wealth marry new technology could help shape nation thinking way represent direct assault pluralism independent journalism need recognize oppose across ideological spectrum people commit pluralism independent thought originally publish orange county register  cross post new geography                                 ,State Capital Newsfeed
