Big Tech CEOs grilled by Congress: Key moments from the historic antitrust meeting,,2020-07-30T00:00:00Z,U.S. Federal; International; Ohio; Rhode Island,,Web News,0,five hour wednesday four big tech ceo world powerful company face grilling us lawmaker washington unprecedented hearing alleged anti competitive practice company hearing first five hour wednesday four big tech ceo world powerful company face grilling us lawmaker washington unprecedented hearing alleged anti competitive practice company hearing first time jeff bezos amazon tim cook apple mark zuckerberg facebook sundar pichai google parent alphabet appear together congress big tech ceo appear via video link face moment spotlight house judiciary antitrust subcommittee pichai zuckerberg receive attention sixth final hearing competition digital market committee culmination 13 million document hundred hour interview testimony long stand concern four company worth combined 485tn become dominant rival compete level antitrust regulator fear lack competition lead high price consumer however digital platform offer service free facebook google difficult lawmaker prove consumer bad another charge lack competition stifle innovation theory could lead subpar product service consumer give four tech giant know cutting edge innovation difficult prove congress consider new antitrust law appropriate digital age could prevent much power concentrate company key topic big tech ceo grill facebook neutralise threat zuckerberg stranger grilling congress question facebook acquisition instagram 2012 1bn democratic congressman jerrold nadler press facebook chief report choose acquire instagram rather compete internal facebook document 2012 show zuckerberg describe reason buy instagram neutralise threat walk back comment send via email hour later always clear view instagram competitor complement service zuckerberg reply instagram worth 100bn billion monthly active user state technology week get verdict weekly email hindsight probably look obvious instagram would reach scale today time far obvious zuckerberg say however nadler continue assert facebook buy instagram neutralise competitor exactly type anticompetitive acquisition antitrust law design prevent say amazon heroin bezos rich person world testify congress first time grill amazon practice reveal wall street journal april use datum third party seller inform product decision bezos deny practice one third party seller describe amazon heroin testimonial read committee also face question amazon essential product policy pandemic delay delivery amazon product alexa smart speaker ring doorbell playbook demand go roof reply bezos goal limit essential supply sure perfectly like big tech ceo bezos welcome scrutiny regulator scrutinise large institution whether company government agency non profit say responsibility make sure pass scrutiny fly colour google much traffic google chief pichai arguably face attention committee face allegation google steal content developer skewed search result profit google question google ad platform dominance google account 294 digital ad market facebook follow 234 committee cite document show google employee fear rival website divert traffic revenue google ten year ago google memo observe certain website get quote much traffic google decide put end say democratic congressman david cicilline rhode island pichai deny allegation argue google provide platform small competitor connect consumer new competitor emerge every day today user access information ever say pichai competition drive us innovate also lead well product low choice choice everyone google currently several antitrust investigation law enforcement various us state google also accuse work china accept money country military republican congressman matt gaetz work chinese military absolutely false reply pichai apple rule make go cook face question apple app store practice currently subject eu antitrust probe apple take 30 cut revenue application list store well place restriction developer rule make go subject change apple expect developer go along change leave app store say democratic congressman hank johnson georgia enormous amount power cook counter vast majority developer able keep 100 money make app store apple raise commission price since launch 2008 apple gatekeeper open gate wider say cook want get every app store keep big tech get conservative many republicans use hearing question big tech ceo suppress right wing voice cut chase big tech get conservative say republican congressman jim jordan ohio suspicion hunch fact ahead hearing president donald trump tweet congress bring fairness big tech year ago executive orders washington talk action year people country sick tired republican jim sensenbrenner ask donald trump jr recently post drug hydroxychloroquine take zuckerberg might refer happen twitter hard speak republican congressman greg steube accuse google repress conservative website say email go spam folder constituent nothing algorithm anything political ideology reply pichai get complaint across aisle however republican jamie raskin turn attention colleague issue top perform link  post facebook right wing site facebook try repress conservative speech terrible job understand whining read coronavirus big tech company step plate gd report modal display none important divunit5 display none important divunit2 display none important divunit9 display none important article mpu display none important,WebNews - English
Big Tech CEOs grilled by Congress: Key moments from the historic anti-trust meeting,,2020-07-30T00:00:00Z,U.S. Federal; International; Ohio; Rhode Island,,Web News,0,five hour wednesday four big tech ceo world powerful company face grilling us lawmaker washington unprecedented hearing alleged anti competitive practice company hearing first five hour wednesday four big tech ceo world powerful company face grilling us lawmaker washington unprecedented hearing alleged anti competitive practice company hearing first time jeff bezos amazon tim cook apple mark zuckerberg facebook sundar pichai google parent alphabet appear together congress big tech ceo appear via video link face moment spotlight house judiciary antitrust subcommittee pichai zuckerberg receive attention sixth final hearing competition digital market committee culmination 13 million document hundred hour interview testimony long stand concern four company worth combined 485tn become dominant rival compete level antitrust regulator fear lack competition lead high price consumer however digital platform offer service free facebook google difficult lawmaker prove consumer bad another charge lack competition stifle innovation theory could lead subpar product service consumer give four tech giant know cutting edge innovation difficult prove congress consider new antitrust law appropriate digital age could prevent much power concentrate company key topic big tech ceo grill facebook neutralise threat zuckerberg stranger grilling congress question facebook acquisition instagram 2012 1bn democratic congressman jerrold nadler press facebook chief report choose acquire instagram rather compete internal facebook document 2012 show zuckerberg describe reason buy instagram neutralise threat walk back comment send via email hour later always clear view instagram competitor complement service zuckerberg reply instagram worth 100bn billion monthly active user state technology week get verdict weekly email hindsight probably look obvious instagram would reach scale today time far obvious zuckerberg say however nadler continue assert facebook buy instagram neutralise competitor exactly type anticompetitive acquisition antitrust law design prevent say amazon heroin bezos rich person world testify congress first time grill amazon practice reveal wall street journal april use datum third party seller inform product decision bezos deny practice one third party seller describe amazon heroin testimonial read committee also face question amazon essential product policy pandemic delay delivery amazon product alexa smart speaker ring doorbell playbook demand go roof reply bezos goal limit essential supply sure perfectly like big tech ceo bezos welcome scrutiny regulator scrutinise large institution whether company government agency non profit say responsibility make sure pass scrutiny fly colour google much traffic google chief pichai arguably face attention committee face allegation google steal content developer skewed search result profit google question google ad platform dominance google account 294 digital ad market facebook follow 234 committee cite document show google employee fear rival website divert traffic revenue google ten year ago google memo observe certain website get quote much traffic google decide put end say democratic congressman david cicilline rhode island pichai deny allegation argue google provide platform small competitor connect consumer new competitor emerge every day today user access information ever say pichai competition drive us innovate also lead well product low choice choice everyone google currently several antitrust investigation law enforcement various us state google also accuse work china accept money country military republican congressman matt gaetz work chinese military absolutely false reply pichai apple rule make go cook face question apple app store practice currently subject eu antitrust probe apple take 30 cut revenue application list store well place restriction developer rule make go subject change apple expect developer go along change leave app store say democratic congressman hank johnson georgia enormous amount power cook counter vast majority developer able keep 100 money make app store apple raise commission price since launch 2008 apple gatekeeper open gate wider say cook want get every app store keep big tech get conservative many republicans use hearing question big tech ceo suppress right wing voice cut chase big tech get conservative say republican congressman jim jordan ohio suspicion hunch fact ahead hearing president donald trump tweet congress bring fairness big tech year ago executive orders washington talk action year people country sick tired republican jim sensenbrenner ask donald trump jr recently post drug hydroxychloroquine take zuckerberg might refer happen twitter hard speak republican congressman greg steube accuse google repress conservative website say email go spam folder constituent nothing algorithm anything political ideology reply pichai get complaint across aisle however republican jamie raskin turn attention colleague issue top perform link  post facebook right wing site facebook try repress conservative speech terrible job understand whining read coronavirus big tech company step plate gd report modal display none important divunit5 display none important divunit2 display none important divunit9 display none important article mpu display none important,WebNews - English
"Big Tech CEOs grilled by House;Zuckerberg, Bezos among 4 taking heat on competition",The Associated Press,2020-07-30T00:00:00Z,U.S. Federal; Massachusetts; Ohio; Rhode Island; Wisconsin,,News,944,washington fend accusation stifle competition four big tech ceo facebook mark zuckerberg amazon jeff bezos sundar pichai google tim cook apple answer company practice congress house panel cap yearlong investigation market dominance industry powerful ceo seek defend company amid intense grilling lawmaker wednesday executive provide burst datum show competitive market value innovation essential service consumer sometimes struggle answer pointed question business practice also confront range concern allege political bias effect democracy role china four ceo testify remotely lawmaker sit mask inside hearing room washington among tough question google amazon involve accusation use dominant platform scoop datum competitor way give unfair advantage bezos say first testimony congress could guarantee company access seller datum make compete product allegation company executive previously deny regulator europe scrutinize amazon relationship business sell site whether online shopping giant use datum seller create private label product policy use seller specific datum aid private label business bezos say response question rep pramila jayapal washington democrat guarantee policy violate pichai opening remark tout google value mom pop business bristol rhode island pewaukee wisconsin home district antitrust panel democratic chairman rhode island rep david cicilline ranking republican rep james sensenbrenner wisconsin google executive struggle cicilline accuse company leverage dominant search engine steal idea information website manipulate result drive people digital service boost profit pichai repeatedly deflect cicilline attack assert google try provide helpful relevant information hundred million people use search engine day effort keep come back instead defect rival service microsoft bing democrats largely focus market competition several republicans air long stand grievance tech company censor conservative voice question business activity china big tech get conservative say rep jim jordan ohio tweet hearing president donald trump challenge congress crack company accuse without evidence bias conservative general congress bring fairness big tech year ago executive orders trump tweet executive order limited scope law pass congress though force law president use executive order alter federal statute take congressional action trump justice department urge congress roll back long hold legal protection online platform facebook google twitter propose change would strip bedrock protection generally shield company legal responsibility people post platform four tech ceo command corporation gold plate brand million even billion customer combine value great entire german economy one bezos world rich individual zuckerberg fourth rank billionaire critic question whether company stifle competition innovation raise price consumer pose danger society bipartisan investigation judiciary subcommittee collect testimony mid level executive four firm competitor legal expert pore million internal document company key question whether exist competition policy century old antitrust law adequate oversee tech giant new legislation enforcement funding need cicilline call four company monopoly although say break last resort force breakup may appear unlikely wide scrutiny big tech point toward possible new restriction power cicilline also say wake coronavirus pandemic giant stand profit become even powerful million shift work commerce online company face legal political offensive multiply front congress trump administration federal state regulator european watchdog justice department federal trade commission investigate four company practice rep david cicilline ri speak house judiciary subcommittee hear antitrust capitol hill wednesday washington  rep jim jordan r ohio listen house judiciary subcommittee hear antitrust capitol hill wednesday washington ,Telegram & Gazette (Massachusetts)
Big Tech CEOs grilled by US lawmakers in antitrust probe,,2020-07-29T00:00:00Z,U.S. Federal,,News,611,jul 29 2020  ceo facebook google amazon apple defend company front us congressional committee consider adapt us antitrust law digital age amazon jeff bezos apple tim cook facebook mark zuckerberg google sundar pichai testify via video conference us congress antitrust committee wednesday first time four appear together joint hearing lawmaker accuse company stifle competition abuse market dominance expense consumer innovation critic tech giant say tough regulation new law need oversight tech company consumer protection read facebook ad boycott chance stop hate another pr campaignfacebook instagram grabthe executive maintain company offer essential service consumer encourage competition present datum lawmaker show competitive respective market however sometimes struggle answer direct question business practice zuckerberg grill facebook purchase rival social medium platform instagram jerrold nadler democrat lead house judiciary committee tell zuckerberg document obtain facebook tell disturbing story company instagram acquisition say ceo call photo message service threat could meaningfully hurt facebook read data privacy pretty much bad case scenario say whistlebloweramazon steal dataamazon accuse hurt small retailer retailer marketplace company accuse take datum vendor platform use create amazon label product first testimony congress amazon bezos say policy use seller datum aid private label business could guarantee policy violate apple app store say force developer use payment system order app apple device read apple tax ruling ireland shine light global tax avoidancegoogle pichai question ethical issue surround present third party datum google manipulate search engine result company advantage pichai say google search engine block website comply law otherwise search result run algorithm much powerdavid cicilline chairman house antitrust subcommittee say tech giant much power read opinion europe must trust us datum protectionwhether self preference predatory pricing require user buy additional product dominant platform wield power destructive harmful way order expand cicilline say democrat congressman add covid19 pandemic likely mean company emerge strong powerful ever company business shift operation online current us antitrust law make difficult crack company large dominant without prove harm consumer abuse market power us congress rewrite antitrust law congressional committee would play key role draw blueprint new antitrust law digital age however would require fundamental change century old us competition rule wmr rt ,Newstex Blogs
Big Tech CEOs grilled by US lawmakers in antitrust probe,,2020-07-29T00:00:00Z,U.S. Federal; International,,Web News,0,amazon jeff bezos apple tim cook facebook mark zuckerberg google sundar pichai testify via video conference us congress antitrust committee wednesday first time four appear together joint hearing lawmak amazon jeff bezos apple tim cook facebook mark zuckerberg google sundar pichai testify via video conference us congress antitrust committee wednesday first time four appear together joint hearing lawmaker accuse company stifle competition abuse market dominance expense consumer innovation critic tech giant say tough regulation new law need oversight tech company consumer protection facebook instagram grab executive maintain company offer essential service consumer encourage competition present datum lawmaker show competitive respective market however sometimes struggle answer direct question business practice zuckerberg grill facebook purchase rival social medium platform instagram jerrold nadler democrat lead house judiciary committee tell zuckerberg document obtain facebook tell disturbing story company instagram acquisition say ceo call photo message service threat could meaningfully hurt facebook read data privacy pretty much bad case scenario say whistleblower amazon steal datum amazon accuse hurt small retailer retailer marketplace company accuse take datum vendor platform use create amazon label product first testimony congress amazon bezos say policy use seller datum aid private label business could guarantee policy violate apple app store say force developer use payment system order app apple device read apple tax ruling ireland shine light global tax avoidance google pichai question ethical issue surround present third party datum google manipulate search engine result company advantage pichai say google search engine block website comply law otherwise search result run algorithm much power david cicilline chairman house antitrust subcommittee say tech giant much power read opinion europe must trust us datum protection whether self preference predatory pricing require user buy additional product dominant platform wield power destructive harmful way order expand cicilline say democrat congressman add covid19 pandemic likely mean company emerge strong powerful ever company business shift operation online current us antitrust law make difficult crack company large dominant without prove harm consumer abuse market power us congress rewrite antitrust law congressional committee would play key role draw blueprint new antitrust law digital age however would require fundamental change century old us competition rule wmr rt ,WebNews - English
Big Tech CEOs Head To Washington July 27 To Testify In Antitrust Probe,,2020-07-07T00:00:00Z,U.S. Federal; International,,Web News,0,ceo amazon apple facebook google parent alphabet appear congress month part governmental probe company reuters report cite statement house judiciary antitrust subcommittee house j ceo amazon apple facebook google parent alphabet appear congress month part governmental probe company reuters report cite statement house judiciary antitrust subcommittee house judiciary panel chair jerrold nadler antitrust subcommittee chairman david cicilline say essential ceo give testimony allow give statement virtually reuters say mean facebook mark zuckerberg google sundar pichai apple tim cook amazon jeff bezos appear panel lawmaker expect release report antitrust investigation within week outcome investigation expect come new legislation reform regulate digital landscape concern long four big tech firm use position squeeze competition dominate market cicilline tell cnbc interview early year believe competition happen enough tech scene want change four firm also look department justice  addition facebook amazon stare federal trade commission  case state attorney look facebook google would first time four ceo testify together congress although except bezos separately past late june doj say close decide proceed antitrust suit google suit concern google alleged abuse power advertising market google control 90 percent market ad tech tool face criticism year favor product competitor pymnt study cross border merchant friction index june 2020 pymnts cross border merchant friction index analyze key friction point experience consumer browse shop pay purchase international ecommerce site pymnt examine checkout process 266 b2b b2c ecommerce site across 12 industry operate location across europe united states provide comprehensive overview checkout offering related item alphabet amazon antitrust apple big tech ceo congress,WebNews - English
Big Tech CEOs Head To Washington On July 27 To Testify In Antitrust Probe,,2020-07-07T00:00:00Z,U.S. Federal,,News,431,ceo amazon apple facebook google parent alphabet appear congress month part governmental probe company reuters report cite statement house judiciary antitrust subcommittee house judiciary panel chair jerrold nadler antitrust subcommittee chairman david cicilline say essential ceo give testimony allow give statement virtually reuters say continue read big tech ceo head washington july 27 testify antitrust probethe ceo amazon apple facebook google parent alphabet appear congress month part governmental probe company reuters report cite statement house judiciary antitrust subcommittee house judiciary panel chair jerrold nadler antitrust subcommittee chairman david cicilline say essential ceo give testimony allow give statement virtually reuters say mean facebook mark zuckerberg google sundar pichai apple tim cook amazon jeff bezos appear panel lawmaker expect release report antitrust investigation within week outcome investigation expect come new legislation reform regulate digital landscape concern long four big tech firm use position squeeze competition dominate market cicilline tell cnbc interview early year believe competition happen enough tech scene want change four firm also look department justice  addition facebook amazon stare federal trade commission  case state attorney look facebook google would first time four ceo testify together congress although except bezos separately past late june doj say close decide proceed antitrust suit google suit concern google alleged abuse power advertising market google control 90 percent market ad tech tool face criticism year favor product competitor see campaign contact information pymntstags wire united states english,iCrowdNewswire (English)
