Big Tech CEOs Head To Washington On July 27 To Testify In Antitrust Probe,,2020-07-07T00:00:00Z,U.S. Federal; International,,Web News,0,ceo amazon apple facebook google parent alphabet appear congress month part governmental probe company reuters report cite statement house judiciary antitrust subcommittee house j ceo amazon apple facebook google parent alphabet appear congress month part governmental probe company reuters report cite statement house judiciary antitrust subcommittee house judiciary panel chair jerrold nadler antitrust subcommittee chairman david cicilline say essential ceo give testimony allow give statement virtually reuters say mean facebook mark zuckerberg google sundar pichai apple tim cook amazon jeff bezos appear panel lawmaker expect release report antitrust investigation within week outcome investigation expect come new legislation reform regulate digital landscape concern long four big tech firm use position squeeze competition dominate market cicilline tell cnbc interview early year believe competition happen enough tech scene want change four firm also look department justice  addition facebook amazon stare federal trade commission  case state attorney look facebook google would first time four ceo testify together congress although except bezos separately past late june doj say close decide proceed antitrust suit google suit concern google alleged abuse power advertising market google control 90 percent market ad tech tool face criticism year favor product competitor pymnt study cross border merchant friction index june 2020 pymnts cross border merchant friction index analyze key friction point experience consumer browse shop pay purchase international ecommerce site pymnt examine checkout process 266 b2b b2c ecommerce site across 12 industry operate location across europe united states provide comprehensive overview checkout offering related item alphabet amazon antitrust apple big tech ceo congress,WebNews - English
"BIG TECH CEOS MISLED, DENIED AND EVADED IN CONGRESS STATEMENT OF ALEX HARMAN, COMPETITION POLICY ADVOCATE, PUBLIC CITIZEN",States News Service,2020-07-29T00:00:00Z,U.S. Federal; Dist. of Columbia,,News,203,follow information release public citizen note four big tech ceo amazon jeff bezos apple tim cook google sundar pichai facebook mark zuckerberg testify today house subcommittee antitrust commercial administrative law majority committee clearly demonstrate amazon apple google facebook engage anti competitive illegal behavior ceo mislead deny evade stumble hearing despite irrefutable evidence word zuckerberg blatantly evade question facebook anticompetitive tactic copying bullying buy competitor maintain monopoly despite evidence cook deny apple practice bully developer accept predatory term market dominate app store meanwhile course hearing bezos deflect question company past current predatory business practice become 500 million rich amazon stock climbedit time break regulate company profit exploit consumer datum hurt innovation compete unfairly threaten democracy election,States News Service
Big Tech CEOs pulled up at antitrust hearing but will it translate to strong regulation?,,2020-07-30T00:00:00Z,U.S. Federal; International; Ohio; Rhode Island; Wisconsin,,Web News,0,premise whether exist competition policy law adequate oversee tech giant new legislation need washington congressional lawmaker finally get chance grill ceo big tech dominance alle premise whether exist competition policy law adequate oversee tech giant new legislation need washington congressional lawmaker finally get chance grill ceo big tech dominance allegation monopolistic practice stifle competition clear much advance goal bring world large company heel invective fly wednesday legislator question facebook mark zuckerberg amazon jeff bezos google sundar pichai apple tim cook hearing house judiciary subcommittee antitrust past year panel probe business practice silicon valley giant eye determine need regulate heavily even break nearly five hour testimony questioning however startling revelation strike confrontation executive face hostile questioning frequent interruption lawmaker party little seem land glance blow ceo testify via video lawmaker time appear together committee room display tiny individual figure mostly empty array square committee member seat mask hearing room washington exec provide lot datum purport show much competition face valuable innovation essential service consumer sometimes struggle answer pointed question business practice also confront range concern allege political bias effect us democracy role china panel chairman representative david cicilline rhode island democrat say platform control facebook amazon google apple bottleneck key channel distribution whether control access information marketplace platform incentive ability exploit power say charge exorbitant fee impose oppressive contract extract valuable datum people business rely simply put much power four ceo command corporation whose product weave fabric everyday life million even billion customer combined market value great entire german economy one bezos world rich individual zuckerberg fourth rank billionaire rough moment pichai zuckerberg instance appear discomfited press unsavoury aspect company business get respite inquisitor run time bezos also acknowledge alleged misdeed amazon _ report company use datum generate independent seller platform compete _ would unacceptable prove true outside observer able draw radically different conclusion event richard hamilton jr former justice department antitrust lawyer say everyone committee seem agreement need tough regulation four company _ ominous sign say stephen beck ceo management consulting firm cg42 say tech company brand emerge relatively unscathed particular say cook particularly polish well prepared enable apple ceo put beck call master class term handle situation cook draw less attention lawmaker ceo argue apple dominant market among tough question google amazon involve accusation use dominant platform scoop datum competitor way give unfair advantage bezos appear congress first time say could guarantee company access seller datum make compete product allegation company executive previously deny policy use seller specific datum aid private label business bezos say response question rep pramila jayapal washington democrat guarantee policy violate pichai deploy old washington trick _ appeal specific interest legislator opening remark tout google value mom pop business bristol rhode island pewaukee wisconsin happen locate home district cicilline rep james sensenbrenner wisconsin panel senior republican google executive struggle cicilline accuse company leverage dominant search engine steal idea information website manipulate result drive people digital service boost profit pichai repeatedly deflect cicilline attack assert google try provide helpful relevant information hundred million people use search engine day effort keep come back instead defect rival service microsoft bing democrats largely focus market competition several republicans air longstanding grievance claim tech company censor conservative voice question business activity china big tech get conservative insist representative jim jordan ohio bipartisan investigation judiciary subcommittee collect testimony mid level executive four firm competitor legal expert pore million internal document company key question whether exist competition policy century old antitrust law adequate oversee tech giant new legislation enforcement funding need cicilline call four company monopoly although say break last resort force breakup may appear unlikely wide scrutiny big tech point toward possible new restriction power company face legal political offensive multiply front congress trump administration federal state regulator european watchdog justice department federal trade commission investigate four company practice,WebNews - English
Big Tech CEOs ready defences for hearing into their growing power,,2020-07-23T00:00:00Z,U.S. Federal; International,,Web News,0,ceo facebook amazoncom alphabet google apple set speak house judiciary committee antitrust panel july 27 credit dreamstime chief executive four large us tech company plan deflect criticism ne ceo facebook amazoncom alphabet google apple set speak house judiciary committee antitrust panel july 27 credit dreamstime chief executive four large us tech company plan deflect criticism next week congressional hearing use market power hurt rival say face competition debunk claim dominant ceo facebook amazoncom alphabet google apple set speak house judiciary committee antitrust panel july 27 present testimony virtually accord source familiar plan panel question company part sweeping probe whether actively work harm eliminate small rival always make good choice customer high profile hearing bring together amazon jeff bezos facebook mark zuckerberg apple tim cook google sundar pichai key moment grow backlash big tech united states likely set face executive skeptical lawmaker party many tech lobby group industry critic say hearing unlikely address core antitrust issue bring new information table however apple likely quiz way manage app store face criticism present hurdle newcomer apple tell r euter argue control market share app iphone maker view store feature design ensure security reliability phone apple address issue approval process app store long sore point developer say app hold without warning allegation share key function datum phone location company also contend still face plenty competition source familiar amazon plan say jeff bezos talk option consumer online purchase coronavirus pandemic boost e commerce overall include large retail rival walmart also talk small seller third party marketplace platform continue thrive despite competition amazon source add amazon come scrutiny use datum small seller benefit business bezos also address allegation company take advantage pandemic limit inventory sell small seller stay away bring contentious issue conversation around break company source say facebook zuckerberg follow similar tack another source say expect argue company strong competitor include google amazon advertising side twitter tiktok social medium zuckerberg expect renew facebook call government regulation area harmful content social medium election integrity privacy area company criticize detail google likely argument available recent week firm publish blog post whitepaper assert still face plenty competition fee charge ad buyer seller justified amazon facebook google decline comment much tech ceo appease anti tech critic hearing find truth create news story say carl szabo vice president general counsel industry lobby group netchoice ,WebNews - English
Big Tech CEOs ready defences for US Congress hearing into their growing power,,2020-07-23T00:00:00Z,U.S. Federal; Dist. of Columbia; International,,Web News,0,jeff bezos president ceo amazon owner washington post speak economic club washington dc milestone celebration dinner washington september 13 2018 reuters pic washington july 24 chief executive four th jeff bezos president ceo amazon owner washington post speak economic club washington dc milestone celebration dinner washington september 13 2018 reuters pic washington july 24 chief executive four large us tech company plan deflect criticism next week congressional hearing use market power hurt rival say face competition debunk claim dominant ceo facebook amazoncom inc alphabet google apple set speak house judiciary committee antitrust panel july 27 present testimony virtually accord source familiar plan panel question company part probe whether actively work harm eliminate small rival always make good choice customer high profile hearing bring together amazon jeff bezos facebook mark zuckerberg apple tim cook google sundar pichai key moment grow backlash big tech united states likely set face executive skeptical lawmaker party many tech lobby group say hearing unlikely address core antitrust issue bring new information table however apple likely quiz way manage app store face criticism hurt newcomer apple tell reuters argue control market share app iphone maker view store feature design ensure security reliability phone apple address issue approval process app store long sore point developer say app hold without warning allegation share key function datum phone location company also contend still face plenty competition source say amazon jeff bezos likely talk option consumer online purchase coronavirus pandemic boost e commerce overall include large retail rival walmart also expect talk small seller third party marketplace platform continue thrive despite competition amazon source add amazon come scrutiny use datum small seller benefit business bezos could also address allegation company take advantage pandemic limit inventory sell small seller stay away bring contentious issue conversation around break company source say facebook zuckerberg follow similar tack another source say expect argue company strong competitor include google amazon advertising side twitter tiktok social medium zuckerberg expect renew facebook call government regulation area harmful content social medium election integrity privacy area company criticize detail google likely argument available recent week firm publish blog post white paper assert still face plenty competition fee charge ad buyer seller justified amazon facebook google decline comment much tech ceo appease anti tech critic hearing find truth create news story say carl szabo vice president general counsel industry lobby group netchoice industry observer disagree us regulation deal practice employ large tech company hearing key step direction dipayan ghosh fellow shorenstein center medium politics public policy harvard kennedy school say interview organize capitol forum reuters,WebNews - English
Big Tech CEOs ready defenses for Congressional hearing into their growing power,By Nandita Bose and Diane Bartz Reuters,2020-07-24T00:00:00Z,U.S. Federal; Massachusetts; New Hampshire,,News,641,washington chief executive four large tech company plan deflect criticism next week congressional hearing use market power hurt rival say face competition debunk claim dominant ceo facebook amazoncom inc alphabet google apple set speak house judiciary committee antitrust panel july 27 present testimony virtually accord source familiar plan panel question company part probe whether actively work harm eliminate small rival always make good choice customer high profile hearing bring together amazon jeff bezos facebook mark zuckerberg apple tim cook google sundar pichai key moment grow backlash big tech united states likely set face executive skeptical lawmaker party many tech lobby group say hearing unlikely address core antitrust issue bring new information table however apple likely quiz way manage app store face criticism hurt newcomer apple tell reuters argue control market share app iphone maker view store feature design ensure security reliability phone apple address issue approval process app store long sore point developer say app hold without warning allegation share key function datum phone location company also contend still face plenty competition source say amazon jeff bezos likely talk option consumer online purchase coronavirus pandemic boost e commerce overall include large retail rival walmart also expect talk small seller third party marketplace platform continue thrive despite competition amazon source add amazon come scrutiny use datum small seller benefit business bezos could also address allegation company take advantage pandemic limit inventory sell small seller stay away bring contentious issue conversation around break company source say facebook zuckerberg follow similar tack another source say expect argue company strong competitor include google amazon advertising side twitter tiktok social medium zuckerberg expect renew facebook call government regulation area harmful content social medium election integrity privacy area company criticize detail google likely argument available recent week firm publish blog post white paper assert still face plenty competition fee charge ad buyer seller justified amazon facebook google decline comment much tech ceo appease anti tech critic hearing find truth create news story say carl szabo vice president general counsel industry lobby group netchoice industry observer disagree regulation deal practice employ large tech company hearing key step direction dipayan ghosh fellow shorenstein center medium politics public policy harvard kennedy school say interview organize capitol forum,"The Union Leader (Manchester, NH)"
Big Tech Ceos Ready Defenses For US Congress Hearing Into Their Growing Power,,2020-07-23T00:00:00Z,U.S. Federal; International,,Web News,0,chief executive four large tech company plan deflect criticism next week congressional hearing use market power hurt rival say face competition debunk claim domi chief executive four large tech company plan deflect criticism next week congressional hearing use market power hurt rival say face competition debunk claim dominant ceo facebook amazoncom inc alphabet google apple set speak house judiciary committee antitrust panel july 27 present testimony virtually accord source familiar plan panel question company part sweeping probe whether actively work harm eliminate small rival always make good choice customer high profile hearing bring together amazon jeff bezos facebook mark zuckerberg apple tim cook google sundar pichai key moment grow backlash big tech united states likely set face executive skeptical lawmaker party many tech lobby group industry critic say hearing unlikely address core antitrust issue bring new information table however apple likely quiz way manage app store face criticism present hurdle newcomer apple tell reuters argue control market share app iphone maker view store feature design ensure security reliability phone apple address issue approval process app store long sore point developer say app hold without warning allegation share key function datum phone location company also contend still face plenty competition source familiar amazon plan say jeff bezos talk option consumer online purchase coronavirus pandemic boost e commerce overall include large retail rival walmart also talk small seller third party marketplace platform continue thrive despite competition amazon source add amazon come scrutiny use datum small seller benefit business bezos also address allegation company take advantage pandemic limit inventory sell small seller stay away bring contentious issue conversation around break company source say facebook zuckerberg follow similar tack another source say expect argue company strong competitor include google amazon advertising side twitter tiktok social medium zuckerberg expect renew facebook call government regulation area harmful content social medium election integrity privacy area company criticize detail google likely argument available recent week firm publish blog post whitepaper assert still face plenty competition fee charge ad buyer seller justified amazon facebook google decline comment much tech ceo appease anti tech critic hearing find truth create news story say carl szabo vice president general counsel industry lobby group netchoice ,WebNews - English
Big Tech CEOs ready defenses for US Congress hearing into their growing power,,2020-07-23T00:00:00Z,U.S. Federal; International,,News,630,washington chief executive four large tech company plan deflect criticism next week congressional hearing use market power hurt rival say face competition debunk claim dominant ceo facebook amazoncom inc alphabet google apple set speak house judiciary committee antitrust panel july 27 present testimony virtually accord source familiar plan panel question company part sweeping probe whether actively work harm eliminate small rival always make good choice customer high profile hearing bring together amazon jeff bezos facebook mark zuckerberg apple tim cook google sundar pichai key moment grow backlash big tech united states likely set face executive skeptical lawmaker party many tech lobby group industry critic say hearing unlikely address core antitrust issue bring new information table however apple likely quiz way manage app store face criticism present hurdle newcomer apple tell reuters argue control market share app iphone maker view store feature design ensure security reliability phone apple address issue approval process app store long sore point developer say app hold without warning allegation share key function datum phone location company also contend still face plenty competition source familiar amazon plan say jeff bezos talk option consumer online purchase coronavirus pandemic boost e commerce overall include large retail rival walmart also talk small seller third party marketplace platform continue thrive despite competition amazon source add amazon come scrutiny use datum small seller benefit business bezos also address allegation company take advantage pandemic limit inventory sell small seller stay away bring contentious issue conversation around break company source say facebook zuckerberg follow similar tack another source say expect argue company strong competitor include google amazon advertising side twitter tiktok social medium zuckerberg expect renew facebook call government regulation area harmful content social medium election integrity privacy area company criticize detail google likely argument available recent week firm publish blog post whitepaper assert still face plenty competition fee charge ad buyer seller justified amazon facebook google decline comment much tech ceo appease anti tech critic hearing find truth create news story say carl szabo vice president general counsel industry lobby group netchoice  reuters,Channel NewsAsia
Big Tech CEOs ready defenses for US Congress hearing into their growing power,,2020-07-24T00:00:00Z,U.S. Federal; International,,Web News,0,chief executive four large tech company plan deflect criticism next week congressional hearing use market power hurt rival say face competition debunk claim domi chief executive four large tech company plan deflect criticism next week congressional hearing use market power hurt rival say face competition debunk claim dominant ceo facebook amazoncom inc alphabet google apple set speak house judiciary committee antitrust panel july 27 present testimony virtually accord source familiar plan panel question company part probe whether actively work harm eliminate small rival always make good choice customer high profile hearing bring together amazon jeff bezos facebook mark zuckerberg apple tim cook google sundar pichai key moment grow backlash big tech united states likely set face executive skeptical lawmaker party see also startup benefit influencer marketing many tech lobby group say hearing unlikely address core antitrust issue bring new information table however apple likely quiz way manage app store face criticism hurt newcomer apple tell reuters argue control market share app iphone maker view store feature design ensure security reliability phone apple address issue approval process app store long sore point developer say app hold without warning allegation share key function datum phone location company also contend still face plenty competition source say amazon jeff bezos likely talk option consumer online purchase coronavirus pandemic boost e commerce overall include large retail rival walmart see also leverage technology gain fight pandemic also expect talk small seller third party marketplace platform continue thrive despite competition amazon source add amazon come scrutiny use datum small seller benefit business bezos could also address allegation company take advantage pandemic limit inventory sell small seller stay away bring contentious issue conversation around break company source say facebook zuckerberg follow similar tack another source say expect argue company strong competitor include google amazon advertising side twitter tiktok social medium zuckerberg expect renew facebook call government regulation area harmful content social medium election integrity privacy area company criticize detail google likely argument available recent week firm publish blog post white paper assert still face plenty competition fee charge ad buyer seller justified see also time innovate fast new market trend wake covid19 amazon facebook google decline comment much tech ceo appease anti tech critic hearing find truth create news story say carl szabo vice president general counsel industry lobby group netchoice industry observer disagree regulation deal practice employ large tech company hearing key step direction dipayan ghosh fellow shorenstein center medium politics public policy harvard kennedy school say interview organize capitol forum covid 19 time series,WebNews - English
