Ticker Tape: A Financial Briefing by Baruch College's Investment Management Group,Gloria Ghita,2019-09-23T00:00:00Z,U.S. Federal,,News,614,technology sector headline summer dominate trade dispute united states china uncertainty semiconductor industry large number tech initial public offering regulatory case big tech ongoing growth cloud cloud date center 5 g connectivity remain large investment category speak cloud growth drive revenue growth across technology company less talk cognitive computing automation tool spotlight vastly improve customer insight increase efficiency advancement digital tool allow company better analyze datum gain insight customer also competitor efficiency also grow bankruptcy process restructuring afterwards tech company play large role assist company antitrust investigation continue united states house judiciary committee ask variety document include email executive financial statement information competitor market share merger key business decision big tech executive executive include amazon ceo jeff bezos facebook ceo mark zuckerberg apple ceo tim cook google larry page sergey brin eric schmidtit unlikely company give access house committee negotiation document request likely commence soon several investigation underway big tech include investigation justice department federal trade commission texas ag group ny ag group however action big tech likely year away consider large ramp spend company put place influence antitrust discourse sanction company must impose federal state law enforcer congress despite technology company might wait act microsoft clo brad smith recently come say law around world go change technology global american company adopt new approach even congress nothinghowever call regulation skeptical law gear make internet platform accountable content pose great threat competition microsoft another note 2019 extremely active year tech ipo despite uber lyft disappointing performance top tech ipo outperform sampp 500 year 67 gain include cloudflare jump 20 first trading day september 13there many caveat comparison include factor market cap lock expiration notably necessity beyond meat ipo basket 524 since market debut follow beyond meat stellar performance videoconference company zoom 120 security vendor crowdstrike 91 big laggard lyft 36 follow uber 26 e commerce company realreal 15from macro viewpoint technology company continue expand emerge market swallow currency headwind highlight risk continued geopolitical uncertainty include united states china trade dispute unpredictability china decline smartphone demand cloud computing continue center attention tech industry significant margin improvement follow artificial intelligence computing datum center cybersecurity solution 5 g connectivity internet thing,University Wire
Ticker Tape A Financial Briefing by Baruch College s Investment Management Group -- the ticker,Gloria Ghita,2019-09-23T00:00:00Z,U.S. Federal,,News,614,technology sector headline summer dominate trade dispute united states china uncertainty semiconductor industry large number tech initial public offering regulatory case big tech ongoing growth cloud cloud date center 5 g connectivity remain large investment category speak cloud growth drive revenue growth across technology company less talk cognitive computing automation tool spotlight vastly improve customer insight increase efficiency advancement digital tool allow company better analyze datum gain insight customer also competitor efficiency also grow bankruptcy process restructuring afterwards tech company play large role assist company antitrust investigation continue united states house judiciary committee ask variety document include email executive financial statement information competitor market share merger key business decision big tech executive executive include amazon ceo jeff bezos facebook ceo mark zuckerberg apple ceo tim cook google larry page sergey brin eric schmidtit unlikely company give access house committee negotiation document request likely commence soon several investigation underway big tech include investigation justice department federal trade commission texas ag group ny ag group however action big tech likely year away consider large ramp spend company put place influence antitrust discourse sanction company must impose federal state law enforcer congress despite technology company might wait act microsoft clo brad smith recently come say law around world go change technology global american company adopt new approach even congress nothinghowever call regulation skeptical law gear make internet platform accountable content pose great threat competition microsoft another note 2019 extremely active year tech ipo despite uber lyft disappointing performance top tech ipo outperform sampp 500 year 67 gain include cloudflare jump 20 first trading day september 13there many caveat comparison include factor market cap lock expiration notably necessity beyond meat ipo basket 524 since market debut follow beyond meat stellar performance videoconference company zoom 120 security vendor crowdstrike 91 big laggard lyft 36 follow uber 26 e commerce company realreal 15from macro viewpoint technology company continue expand emerge market swallow currency headwind highlight risk continued geopolitical uncertainty include united states china trade dispute unpredictability china decline smartphone demand cloud computing continue center attention tech industry significant margin improvement follow artificial intelligence computing datum center cybersecurity solution 5 g connectivity internet thing,University Wire
Tide slowly starts to turn on tech's brave new world,Max Mason | Media and marketing editor,2019-12-14T00:00:00Z,U.S. Federal; International,,News,954,social medium accc inquiry mobilise regulator worldwide one question take longit awkward introduction one big shift facebook attitude towards journalism medium industry one could hardly surprise news corp global chief executive robert thomson take stage social medium giant founder chief executive mark zuckerberg october announce new initiative facebook pay news thomson quirky hard nosed australian journalist rise top rupert murdoch medium empire one loud global voice call action big tech despite target finally relent zuckerberg day ready stir pot far last year appreciation nice thing could say mean actually think something good zuckerberg laugh take compliment however model facebook agree news corp us publisher far perfect still leave facebook arbiter news medium deserve pay work platform facebook pay publisher us us1 million  us3 million still perfect confluence event every corner world despite facebook google executive downplay significance regulatory inquiry go australia play major role bring facebook point know tide turn view facebook would contemplate year ago demonstrate willingness move australian competition consumer commission chairman rod sims say accc code conduct could also model jurisdiction facebook could see change come australia drive accc local medium company accc inquiry also major input similar inquiry uk heavily reference uk competition regulator submission inquiry sim also brief competition regulator lawmaker us state europe plan think every internet platform responsibility try help fund form partnership support news zuckerberg say fireside chat thomson meanwhile facebook come increase pressure home market zuckerberg google counterpart sundar pichai tech executive drag capitol hill front us lawmaker increase regularity recent year range issue wall street journal news corp report thursday us federal trade commission seek injunction antitrust concern app interaction rival morrison government take sim recommendation code conduct force tech giant like facebook google negotiate local medium company sharing revenue datum algorithm change government give tech giant chance come voluntary code along industry accc state force mandatory code november come satisfactory agreement facebook google initially come strong code conduct google step back position later call sensible idea hugh marks chief executive nine australian financial review say code provide clear timeline method medium big tech find solution ultimately believe win win industry people work social platform well devil detail particularly whether government enough bite come facebook google something help local medium company tech giant refuse come table voluntary basis uk competition markets authority undertake similar study digital platform online advertising final report due mid2020 facebook google could face similar code conduct govern business relationship player market tackle issue market power consider whether ex ante rule require overcome concern identify relation market power consumer face market digital advertising market cma say statement scope potential area could cover regime could include rule term platform transact market participant relate example discrimination pricing increase transparency different activity undertake platform separation certain activity digital advertising value chain uk medium outlet broadcaster channel 4 guardian media group rally behind idea code conduct include revenue sharing help mitigate imbalance bargaining power technology giant take leave term force accept facebook google given similarity trading term lack strong competition market channel 4 leave little choice accept revenue share offer digital giant channel 4 say submission however fail take account expense incur produce premium psb quality content brave new world form big tech government ensure industry get,Australian Financial Review
Tide turns on social media giants in US;California leads legislative moves with privacy law modelled in part on GDPR,Suzanne Lynch,2019-08-08T00:00:00Z,U.S. Federal; California; International; Missouri; New York,,News,1548,democrats reel donald trump shock victory 2016 us presidential election thought soon turn could take republican president 2020 one name surface facebook chief executive mark zuckerberg speculation young executive political ambition prompt set listening tour across country despite denial mull bid office less year later thing look different november 2017 zuckerberg summon washington testify congress question two senate committee facebook founder probe company role russia interference 2016 election concern facebook surface early year us intelligence service announce russia try influence us voter zuckerberg initially dismiss suggestion company involvement pretty crazy idea say voter make decision base live experience comment would come regret september 2017 revelation emerge russian base institution spend thousand politically divisive ad facebook post statement platform apologise comment political concern zuckerberg fall darling left target political concern power tech company reflect shift attitude united states towards social medium giant since establishment company google facebook twitter decade ago united states take laissez faire approach regulation compare europe fuel grow concern country germany country acutely aware importance citizen privacy give history european union move quickly regulate tech company term user privacy also field competition tax follow year negotiation brussels strasbourg eu gdpr  enter force year ago introduce sweeping new power consumer simultaneously eu powerful anti trust arm open competition inquiry company google amid alarm dominance market google hit multibillion dollar fine amazon remain scrutiny brussels use third party datum boost sale model motivation us attitude different regulator slow question model motivation tech sector 2015 president obama anger eu suggest eu inquiry company google facebook commercially drive imply europe simply annoy company unable compete us internet company create expand perfect way compete say relation deteriorate wikileaks reveal us national security agency tap german chancellor angela merkel phone decade four year later attitude us different first sign change offing emerge last year california introduce new privacy law model part eu landmark gdpr law california consumer privacy act due come effect early next year regulation consumer allow view type datum collect company request right company delete datum addition company require include opt link conspicuously website whereby user request datum sell third party several state consider introduce version law imminent introduction new regulation spark alarm among tech company prompt scramble congress come us wide approach privacy basically game term ignore tech regulation long california law completely change debate writing wall time us need something come oversight say one policy official involve effort introduce new privacy law washington tech company enthusiastic support introduction federal law washington apparent willingness come new regulatory system tech company year sit hand prompt scepticism many suspect reason new find interest regulate tech company federal level industry hope new national rule weak california law echo take place european parliament four five year ago intense debate take place congress within white house far new restriction company handle datum go tech company consumer right advocate pour resource lobby member congress shape significant technology regulation generation pressure big tech company intensify recent week democratic presidential contender elizabeth warren call break tech company amazon google argue harm competition prioritise service platform buy competitor proposal follow explosive new york times article facebook co founder chris hughes call company found zuckerberg break tightly regulate woe tech giant continue month us federal trade commission reach 5 billion settlement facebook big history though still fraction company annual revenue regulator allege social medium company erode privacy right misuse customer datum target advertisement justice department anti trust division also announce investigation social medium platform see powerful tech company engage practice reduce competition stifle innovation otherwise harm consumers tech company hit back argue much regulation may allow chinese competitor muscle sector way would bad democracy privacy american public reassess view silicon valley reason amid grow awareness rapid development us tech sector bring downside great san francisco area suffer acute housing crisis rent high country much side effect booming tech industry new raft silicon valley ipo slate year likely push price even far amazon decision pull plan investment queens new york concern raise many local resident include congresswoman alexandria ocasio cortez also suggest american consumer begin question relentless expansion big tech really benefit negative headline continue slew negative headline regard role social medium company promote fake news also contribute techlash circulation doctor video purport show house speaker nancy pelosi slur word facebook twitter highlight role social medium company play online disinformation major concern us ahead 2020 election concern emanate left trump many way master manipulator twitter convene social medium summit white house early month berate social medium company exhibit liberal bias silence supporter josh hawley young republican senator missouri bring forward new bill would remove tech giant protection liability third party content nonetheless threat curb power online giant still likely meet resistance washington senate committee hearing may address data protection expert include ireland helen dixon several republican member warn excessive regulation congress mull federal law alternative californian model time want protect privacy want avoid regulatory system impose unnecessary burden threaten job say senator ted cruz quoting research last year us national bureau economic research claim europe lose 39000 tech job due gdprlegislators also mindful another aspect american consumer relationship tech company technology giant drive strong performance stock market upward trajectory benefit million americans saving retirement account many legislator loath anything jeopardise success tide turn come regulation tech company come month crucial determine whether change perspective stay,The Irish Times
Tiger Global Managements Top 1st-Quarter Updates,,2020-05-20T00:00:00Z,U.S. Federal; California,,News,1697,may 20 2020  tiger global management top 1st quarter updates gurufocuscom tiger global management top 1st quarter updates gurufocuscom bookmark page delete tech focused hedge fund invest alibaba trim ubertiger global management recently disclose portfolio update first quarter 2020 end march 31 tiger global management found 2001 chase coleman  portfolio hedge fund legend julian robertson  portfolio give 25 million start fund fund strategy deploy capital globally focus big tech stock well early late stage venture post initial public offering private equity secondary market small cap january firm close new 375 billion fund invest private technology reveal continue investor enthusiasm tech company use investing criterion firm establish three new common stock holding quarter notably athene holding ltd  add several position include workday inc  alibaba group holding ltd  also sell two holding reduce include uber technologies inc  athene holding firm big new buy quarter athene holding acquire 7464626 share impact equity portfolio 112 quarter share trade average price 4016 athene retirement service company issue reinsure acquire retirement saving population increase percentage old retired person company headquarter bermuda tax reason though main clientele may 20 share athene trade around 2669 market cap 52 billion price earning ratio 1435 peter lynch chart indicate stock trade near fair value gurufocus give company financial strength score 4 10 profitability score 5 10 cash debt ratio 391 high industry median 229 show chart company general uptrend revenue net income though result affect stock market price asset workday firm buy 2040000 additional share workday increase stake 73381 trade 160 impact equity portfolio share trade average price 16905 quarter headquarter pleasanton california workday enterprise cloud solution company provide software management financial asset well human capital may 20 share workday trade around 15954 market cap 3722 billion morningstar analyst estimate produce forward price earning ratio 7397 though company yet turn yearly profit gurufocus give workday financial strength score 5 10 profitability score 3 10 company cash debt ratio 124 altman z score 458 indicate danger bankruptcy three year revenue growth rate impressive 262 operate margin 1385 net margin 1325 confirm company burn cash generate alibabatiger global management add 976000 share 2776 alibaba position bring total number share 4491662 impact equity portfolio 114 share trade average price 20923 quarter alibaba chinese multinational conglomerate holding e commerce retail internet technology asset among many volume alibaba large e commerce company world million merchant hundred million user may 20 share alibaba trade around 21504 market cap 57399 billion price earning ratio 2311 accord peter lynch chart stock trade intrinsic value median historical valuation alibaba gurufocus financial strength score 7 10 profitability score 10 10 cash debt ratio 292 altman z score 682 indicate high financial stability operate margin 1921 high 9486 competitor revenue net income grow steadily recent year uber technology firm reduce holding uber technologies 11640071 share 5385 bring total number share 9974716 trade 119 impact equity portfolio quarter share trade average price 33 famous world large rideshare company uber also offer food delivery electric bike scooter various technology project company base san francisco operate 63 country worldwide may 20 share uber trade around 3438 market cap 5963 billion exclude first quarter publicly trade company affect divestment company profitable quarter gurufocus give company financial strength rating 4 10 profitability rating 1 10 cash debt ratio 106 low 6281 competitor altman z score 058 mean company may need source additional liquidity avoid bankruptcy operate margin 6048 net margin 7148 indicate company burn significantly cash earn portfolio overview quarter end firm hold share 74 stock value total 1661 billion top holding jdcom inc  1235 equity portfolio microsoft corp  1025 facebook inc  879 term portfolio weighting firm invest technology consumer cyclical communication service disclosure author share stock mention mention stock article point constitute investment recommendation portfolio update reflect common stock position per regulatory filing quarter question may include change make quarter end read premium member gurufocus sign free 7day trial also check comment please leave comment gurufocus link selection note store portfolio            ,Newstex Blogs
"Tighter rein on Google, Facebook",Lilly Vitorovich,2019-02-13T00:00:00Z,International,,News,485,momentum gather around world increase regulation major technology company include google facebook british government commission report recommend news quality regulator cairncross review undertake former journalist dame frances cairncross request uk government propose news quality regulator hold online platform account spread misinformation also recommend digital news product enjoy tax exemption newspaper nation public broadcaster bbc face restriction digital operation cairncross review come three month australia competition regulator say google facebook substantial market power outline 11 recommendation include close scrutiny activity government agency tough new datum collection rule bridget fair represent australia commercial free air television broadcaster industry group free tv australia say grow appetite regulatory oversight global tech giants support google facebook great make money back people content ms fair tell australian cautious subjective assessment quality clear need regulation ensure producer local content include news monetise product fairly digital platform add foad fadaghi managing director local tech research firm telsyte say grow push government around world regulation big tech company give reach impact democracy however might hard cherrypick handful company specific regulation mr fadaghi say hard government different rule company need equitable cairncross review might inform accc focus likely recommendation regulation digital advertising rather journalism regulation necessarily bad establish easy implement industry guideline might futile draconian try manage individual news feed richard gingras google vice president news say company work closely cairncross inquiry look forward discuss proposal ensure sustainable high quality journalism uk commit support vibrant sustainable quality journalism direct user news website 10 billion time month share 70 per cent revenue generate ad technology news publisher response accc digital platform preliminary report due friday final report deliver federal government june 3,The Australian
