Big tech CEOs endure hours of withering questions...,,2020-07-30T00:00:00Z,U.S. Federal; International; New York; Ohio; Rhode Island,,Web News,0,david mclaughlin ben brody chief executive four us technology giant endure wither rapid fire question five hour lawmaker accuse company use power crush rival squash competition david mclaughlin ben brody chief executive four us technology giant endure wither rapid fire question five hour lawmaker accuse company use power crush rival squash competition alphabet inc google facebook inc apple inc amazoncom inc criticize power wield digital market google control internet search online advertising apple tight grip app facebook acquisition rival amazon leverage third party seller company exist today monopoly power say representative david cicilline rhode island lead yearlong house investigation company need break need heavily regulate cicilline say adjourn hearing stretch evening chief executive four company alphabet sundar pichai facebook mark zuckerberg apple tim cook amazon jeff bezos testify house antitrust committee remote location unfailingly polite even though lawmaker frequently cut rigorously enforce five minute rule per member lawmaker pepper executive question specific example intend show company thwart competitive threat hearing mark escalation antitrust scrutiny sector internet platform combine value nearly 5 trillion already investigation federal trade commission justice department state across country also probe facebook google testimony document produce panel could use inform inquiry lawmaker uncover several potentially damning example anti competitive behaviour could watershed moment say alex petros policy counsel left lean think tank public knowledge advocate strong antitrust enforcement could put pressure doj ftc really conduct full investigation cicilline say expect committee complete report month attack pichai practice google unit search engine accuse steal content goal keep user site rather direct source web evidence seem clear google become gateway internet begin abuse power say use surveillance web traffic identify competitive threat crush business want find web add must pay google tax wednesday session first time bezos testify congress hearing mark first time four tech leader appear together democrats split question focus market power google facebook amazon apple republicans largely complain anticonservative bias google facebook republican jim jordan ohio cite numerous example say show tech company include twitter inc silence conservative view cut chase big tech get conservative say suspicion hunch fact jerrold nadler new york democrat chair house judiciary committee say document obtain committee show facebook buy instagram 2012 neutralize emerge competitor ask instagram break facebook facebook see instagram threat could potentially siphon business away facebook nadler say rather compete facebook buy exactly type anti competitive acquisition antitrust law design prevent zuckerberg say instagram face many competitor time instagram succeed facebook investment cicilline also target facebook content platform say company incentive carry misinformation hate speech violent content drive engagement therefore profitable zuckerberg dispute claim argue user want see facebook get away game town say competition force police platform allow misinformation spread lead violence frankly believe strike heart american democracy democrat pramila jayapal washington question bezos amazon use datum third party sale compete vendor bezos say company policy use seller specific datum aid private label business guarantee policy never violate access datum far exceed seller platform compete jayapal say set rule game competitor actually follow rule medium report find policy violate representative lucy mcbath georgia democrat play recording amazon bookseller say business grow take market share amazon retaliate block business sell textbook amazon much power seller place go mcbath say amazon monopoly power seller think would choose stay relationship characterize bully fear panic say bezos say familiar bookseller case want learn insist amazon good third party seller write testimony release late tuesday ceo tell congress competition thrive across tech industry consumer benefit result global retail market compete strikingly large extraordinarily competitive bezos say statement unlike industry winner take room retail many winner tout various way help small business grow whether third party seller amazon independent developer build app apple app store also portray company embody american entrepreneurship cicilline say hearing many response ceo confirm thing panel learn inquiry say important hear ceo acknowledgement anti competitive practice really heart investigation,WebNews - English
Big Tech CEOs endure hours of withering questions from congress,,2020-07-30T00:00:00Z,U.S. Federal; International; New York; Ohio; Rhode Island,,Web News,0,chief executive four us technology giant endure wither rapid fire question five hour lawmaker accuse company use power crush rival squash competition alphabet inc google facebook inc chief executive four us technology giant endure wither rapid fire question five hour lawmaker accuse company use power crush rival squash competition alphabet inc google facebook inc apple inc amazoncom inc criticise power wield digital market google control internet search online advertising apple tight grip app facebook acquisition rival amazon leverage third party seller company exist today monopoly power say representative david cicilline rhode island lead year long house investigation company need break need heavily regulate cicilline say adjourn hearing stretch evening chief executive four company alphabet sundar pichai facebook mark zuckerberg apple tim cook amazon jeff bezos testify house antitrust committee remote location unfailingly polite even though lawmaker frequently cut rigorously enforce five minute rule per member lawmaker pepper executive question specific example intend show company thwart competitive threat hearing mark escalation antitrust scrutiny sector internet platform combine value nearly us 5tril  already investigation us federal trade commission justice department state across country also probe facebook google testimony document produce panel could use inform inquiry lawmaker uncover several potentially damning example anti competitive behaviour could watershed moment say alex petros policy counsel left lean think tank public knowledge advocate strong antitrust enforcement could put pressure doj ftc really conduct full investigation cicilline say expect committee complete report month attack pichai practice google unit search engine accuse steal content goal keep user site rather direct source web evidence seem clear google become gateway internet begin abuse power say use surveillance web traffic identify competitive threat crush business want find web add must pay google tax july 29 session first time bezos testify congress hearing mark first time four tech leader appear together democrats split question focus market power google facebook amazon apple republicans largely complain anticonservative bias google facebook republican jim jordan ohio cite numerous example say show tech company include twitter inc silence conservative view cut chase big tech get conservative say suspicion hunch fact jerrold nadler new york democrat chair house judiciary committee say document obtain committee show facebook buy instagram 2012 neutralise emerge competitor ask instagram break facebook facebook see instagram threat could potentially siphon business away facebook nadler say rather compete facebook buy exactly type anti competitive acquisition antitrust law design prevent zuckerberg say instagram face many competitor time instagram succeed facebook investment cicilline also target facebook content platform say company incentive carry misinformation hate speech violent content drive engagement therefore profitable zuckerberg dispute claim argue user want see facebook get away game town say competition force police platform allow misinformation spread lead violence frankly believe strike heart american democracy democrat pramila jayapal washington question bezos amazon use datum third party sale compete vendor bezos say company policy use seller specific datum aid private label business guarantee policy never violate access datum far exceed seller platform compete jayapal say set rule game competitor actually follow rule medium report find policy violate representative lucy mcbath georgia democrat play recording amazon bookseller say business grow take market share amazon retaliate block business sell textbook amazon much power seller place go mcbath say amazon monopoly power seller think would choose stay relationship characterise bully fear panic say bezos say familiar bookseller case want learn insist amazon good third party seller write testimony release late july 28 ceo tell congress competition thrive across tech industry consumer benefit result global retail market compete strikingly large extraordinarily competitive bezos say statement unlike industry winner take room retail many winner tout various way help small business grow whether third party seller amazon independent developer build app apple app store also portray company embody american entrepreneurship cicilline say hearing many response ceo confirm thing panel learn inquiry say important hear ceo acknowledgement anticompetitive practice really heart investigation bloomberg,WebNews - English
Big Tech CEOs Endure Hours of Withering Questions From Congress,,2020-07-30T00:00:00Z,U.S. Federal; International; New York; Ohio; Rhode Island,,Web News,0,alphabet inc google facebook inc apple inc amazoncom inc criticize power wield digital market google control internet search online advertising apple tight grip app facebook acquisition rival alphabet inc google facebook inc apple inc amazoncom inc criticize power wield digital market google control internet search online advertising apple tight grip app facebook acquisition rival amazon leverage third party seller company exist today monopoly power say representative david cicilline rhode island lead yearlong house investigation company need break need heavily regulate cicilline say adjourn hearing stretch evening chief executive four company alphabet sundar pichai facebook mark zuckerberg apple tim cook amazon jeff bezos testify house antitrust committee remote location unfailingly polite even though lawmaker frequently cut rigorously enforce five minute rule per member lawmaker pepper executive question specific example intend show company thwart competitive threat hearing mark escalation antitrust scrutiny sector internet platform combine value nearly 5 trillion already investigation federal trade commission justice department state across country also probe facebook google testimony document produce panel could use inform inquiry lawmaker uncover several potentially damning example anti competitive behavior could watershed moment say alex petros policy counsel left lean think tank public knowledge advocate strong antitrust enforcement could put pressure doj ftc really conduct full investigation cicilline say expect committee complete report month attack pichai practice google unit search engine accuse steal content goal keep user site rather direct source web evidence seem clear google become gateway internet begin abuse power say use surveillance web traffic identify competitive threat crush business want find web add must pay google tax wednesday session first time bezos testify congress hearing mark first time four tech leader appear together democrats split question focus market power google facebook amazon apple republicans largely complain anticonservative bias google facebook republican jim jordan ohio cite numerous example say show tech company include twitter inc silence conservative view cut chase big tech get conservative say suspicion hunch fact jerrold nadler new york democrat chair house judiciary committee say document obtain committee show facebook buy instagram 2012 neutralize emerge competitor ask instagram break facebook facebook see instagram threat could potentially siphon business away facebook nadler say rather compete facebook buy exactly type anti competitive acquisition antitrust law design prevent zuckerberg say instagram face many competitor time instagram succeed facebook investment cicilline also target facebook content platform say company incentive carry misinformation hate speech violent content drive engagement therefore profitable zuckerberg dispute claim argue user want see facebook get away game town say competition force police platform allow misinformation spread lead violence frankly believe strike heart american democracy document show facebook buy instagram quash competitor democrat pramila jayapal washington question bezos amazon use datum third party sale compete vendor bezos say company policy use seller specific datum aid private label business guarantee policy never violate access datum far exceed seller platform compete jayapal say set rule game competitor actually follow rule medium report find policy violate representative lucy mcbath georgia democrat play recording amazon bookseller say business grow take market share amazon retaliate block business sell textbook amazon much power seller place go mcbath say bezos say familiar bookseller case want learn insist amazon good third party seller read big tech write testimony release late tuesday ceo tell congress competition thrive across tech industry consumer benefit result global retail market compete strikingly large extraordinarily competitive bezos say statement unlike industry winner take room retail many winner tout various way help small business grow whether third party seller amazon independent developer build app apple app store also portray company embody american entrepreneurship cicilline say hearing many response ceo confirm thing panel learn inquiry say important hear ceo acknowledgement anticompetitive practice really heart investigation,WebNews - English
"Big Tech CEOs expect to be grilled over antitrust issues, role in elections by Congress",Ryan Lovelace,2020-07-29T00:00:00Z,U.S. Federal; Dist. of Columbia; New York; Ohio; Rhode Island,,News,735,titan big tech head capitol hill wednesday fend lawmaker attempt break company lawmaker grill ceo amazon apple facebook google parent company alphabet antitrust issue also expect ask executive censorship voter suppression role 2020 election house judiciary committee antitrust subcommittee begin investigate tech giant last summer hearing finally put spotlight amazon jeff bezos apple tim cook facebook mark zuckerberg google sundar pichai give central role corporation play life american people critical ceo forthcoming say democratic reps jerrold nadler new york david cicilline rhode island chairman committee subcommittee respectively testimony essential us complete investigation technology watchdog worried lawmaker may get distract non antitrust issue especially amid backdrop november election mike davis founder conservative internet accountability project say company become clear monopolist committee focus consolidation power harm small business censor political speech key house judiciary republicans get dupe use big tech conflate law enforcement regulation mr davis say conservative believe immigration amnesty believe antitrust amnesty conservative want lawmaker use limited opportunity grill ceo content moderation policy media research center founder l brent bozell iii organize free speech alliance 35 conservative activist dare google ceo swear oath hearing censor conservative believe google lie yet read alliance letter mr pichai old game censor conservative wait someone else call blame algorithm another technical problem censorship somehow never manage discover glitch always victim approach scandal one utter lack transparency become second nature organization merely shameful clear present danger civil society need answer liberal activist however say social medium enable president trump rise think social medium company facebook crack hard enough conservative voice mr zuckerberg testify house financial services committee last year regard cryptocurrency project facebook pursue call libra democrats instead quiz relationship conservative medium personality 100 day election liberal activist want see mr zuckerberg ceo explain fight voter suppression stomp misinformation site sarah miller executive director liberal american economic liberties project want democratic lawmaker focus instead threat think pose technology leader policymaker enforcer allow big tech baron bully worker consumer business far long ms miller say statement outcome subcommittee investigation monopoly power central whether market become fair whether congress reassert power handful man whose corporation threaten democracy trump administration weigh whether regulate company potential democratic administration favor aggressive regulatory regime ceo testimony may determine contour internet regulation come year committee democratic leader rebuff republican request put ceo full judiciary committee give lawmaker crack rep jim jordan ohio top republican committee also request hearing include twitter ceo jack dorsey mr dorsey call come capitol twitter decline comment mr jordan request,The Washington Times
Big Tech CEOs Face U.S. Antitrust Hearing,Deborah DSouza,2020-07-29T00:00:00Z,U.S. Federal,,News,726,jul 29 2020  apple amazon alphabet facebook ceo testify congresshearing focus whether new law need prevent anticompetitive behaviorquestion likely cover acquisition advantage marketplacestech lobbying spend surge record level recent year 20 year bill gates testify congress whether microsoft monopoly chief executive jeff bezos tim cook mark zuckerberg sundar pichai together take question lawmaker similar hearing start noon et title online platforms market power part 6 examine dominance amazon apple facebook google hearing hold house subcommittee antitrust commercial administrative law four firm represent fifth samp38p 500 market cap also announce earning tomorrow stream hearing live  like antitrust drama promise different recent tech hearing bipartisan investigation begin june last year  aim determine whether exist law sufficient keep digital marketplace competitive executive question evidence collect score interview document say use future antitrust probe bill plus bezos first time congressional hearing brief breakdown company expect plan say amazon april wall street journal report employee use sale info third party seller develop private merchandise expect top concern also enough counterfeit product win price war prepare remark focus amazon help economy business bezos success humble root apple control app store market app also take 30 cut developer apple face pressure front eu likely come prepare remark focus apple dominant market share market facebook neutralize competition acquisition like instagram whatsapp also buy gif provider giphy integrate competitor like twitter prepared remark focus fb improve app buy help provide well service people advertiser competition china alphabet search engine dominance push result review ahead competitor allow company buy advertising space appear directly competitor acquisition like nest waze doubleclick prepared remark focus compete platform people get information help small business pandemic big tech know regulation come claim utility anymore lobby datum display fearful facebook also face accusation curb free speech enough stop hate misinformation spend 48 million q2 2020 follow record 5 million q1 accord opensecrets tech company also bankroll heavily influence powerful global antitrust institute  recommend hand approach antitrust law international seminar wonder congress may think necessary try imagine day without use service product four company viable alternative good enough expect government hard firm eu currently pass legislation break yet anyway plus timing could possibly well company amid pandemic help entertain educate feed console soothe consumer public opinion soften last year public enemy 1 people right leave grow surveillance also increase importance interlink government even today lay groundwork antitrust activity may bolster probe currently underway start end  ,Newstex Blogs
"Big tech CEOs get heat over competition;Amazon, Apple, Faceook, Google confront range of concerns before U.S. Congress",Marcy Gordon The Associated Press,2020-07-30T00:00:00Z,U.S. Federal; International; Rhode Island; Wisconsin,,News,1050,washington leader amazon apple facebook google fend accusation wednesday company stifle competition intense questioning lawmaker investigate big tech market dominance past year amazon jeff bezos first appearance congress facebook mark zuckerberg sundar pichai google tim cook apple sometimes struggle answer pointed question business practice even provide datum highlight competitive market value innovation essential service consumer also confront range concern allege political bias effect democracy role china scrutiny big tech could lead new restriction power though force breakup appear unlikely four ceo testify remotely hearing house judiciary subcommittee antitrust lawmaker sit mask inside hearing room washington among tough question google amazon involve accusation use dominant platform scoop datum competitor way give unfair advantage bezos say could guarantee amazon access seller datum make compete product allegation company executive previously deny regulator europe scrutinize amazon relationship business sell site whether online shopping giant use datum seller create private label product pichai opening remark tout google value mom pop business bristol ri pewaukee wi home district antitrust panel democratic chair rhode island rep david cicilline ranking republican rep james sensenbrenner wisconsin google executive struggle cicilline accuse company leverage dominant search engine steal idea information website manipulate result drive people digital service boost profit pichai repeatedly deflect cicilline attack assert google try provide helpful relevant information hundred million people use search engine day effort keep defect rival service microsoft bing facebook turn face renew focus gobbling competitor rep jerrold nadler democrat head house judiciary committee tell zuckerberg document obtain company tell disturbing story facebook acquisition instagram message service say document show zuckerberg call instagram threat could meaningfully hurt facebook zuckerberg respond facebook view instagram competitor complement facebook service also acknowledge compete facebook photo sharing critic facebook call company divest instagram whatsapp message service democrats largely focus market competition several republicans air longstanding grievance tech company censor conservative voice question business activity china tweet hearing president donald trump challenge congress crack company accuse without evidence bias conservative general congress bring fairness big tech year ago executive orders trump tweet executive order limited scope law pass congress though force law president use executive order alter federal statute take congressional action trump justice department urge congress roll back long hold legal protection online platform facebook google twitter propose change would strip bedrock protection generally shield company legal responsibility people post platform four tech ceo command corporation gold plate brand million even billion customer combine value great entire german economy one bezos world rich individual zuckerberg fourth rank billionaire critic question whether company stifle competition innovation raise price consumer pose danger society bipartisan investigation judiciary subcommittee collect testimony mid level executive four firm competitor legal expert pore million internal document company key question whether exist competition policy century old antitrust law adequate oversee tech giant new legislation enforcement funding need cicilline call four company monopoly although say break last resort cicilline also say wednesday wake coronavirus pandemic giant stand profit become even powerful million shift work commerce online sensenbrenner subcommittee top republican reject idea new legislation need suggest antitrust reform could difficult mission democrats congress company face legal political offensive multiply front congress trump administration federal state regulator european watchdog justice department federal trade commission investigate four company practice four tech leader apple cook face light scrutiny wednesday likely reflection difficulty make antitrust case company whose iphone third large seller world apple dominant market share market business cook tell lawmaker company still face eu investigation fee charge app store technical limitation allegedly shut competitor apple pay,The Toronto Star
