Thune asks whether big tech is doing enough to combat the spread of extremist propaganda,"Evan HendershotThe Daily Republic, Mitchell, S.D.",2018-01-17T00:00:00Z,U.S. Federal; South Dakota,,News,277,january 17 effort contain spread extremist propaganda across web south dakota long tenure member congress one key question ask big tech enoughyou sen john thune chair hearing senate committee commerce science transportation wednesday relationship terrorism social medium acknowledge social medium play positive role society slightly point opening remark service thrive online freedom make possible uniquely american guarantee free speech light touch regulatory policy thune say often case enemy way life seek take advantage freedom advance hateful cause violent islamic terrorist group like isis particularly aggressive seek radicalize recruit internet various social medium platform thune republican question witness twitter youtube facebook work identify remove extremist content also note contribution social medium outlet make positive contribution social medium platform well document thune say youtube facebook twitter among help connect people around world give voice oppress totalitarian regime provide forum discussion every political social scientific cultural stripe _ _ _  2018 daily republic  visit daily republic  distribute tribune content agency llc,Tribune Content Agency - Business News
"Thursday briefing: 'Ark did not take so long,' Churchill chafed;Archives reveal candid views of PMs and officials ... Corbyn sacks minister for 'Hitler bunker' jibe ... and sender of message in a bottle from 1969 is found",Warren Murray,2019-07-18T00:00:00Z,U.S. Federal; International; Massachusetts,,News,1767, top story troop call hello warren murray present front page day boris yeltsin look puffy around neck jaw least stay vodka get chest infection get v piss phone call bill clinton botch official latter us president know talk loudly fail act first lady appraisal foreign leader reveal newly unlock government paper national archives show colourful pen portrait caroline davies write staple diplomatic cable long leaking former us ambassador kim darroch emails file show postwar prime minister irk length time rise cost refurbish downing street survey churchill 1954 discover dry rot beetle damage risk nos 10 11 12 partially collapse churchill write shock ministry works contemplate two three year john major enthusiastically support minister official less convince city end lose sydney 1967 anti nuclear protester threaten expose official purpose turnstile vast underground complex wiltshire mean house central government wartime notice committee ministry defence step steer press coverage away official instruction state unless situation develop abnormally troop call hitler bunker labour peer dianne hayter sack shadow brexit minister liken hayter remain party deputy leader lords elect position meeting centre leave labour first group tuesday attack labour leadership response antisemitism complaint  watch film bunker last day hitler stop receive inner group information suggest thing go way want ilford north labour mp wes streeting say hayter sacking gross reaction speed sacking show labour leader quick act protect feeling slow act racist double standard extraordinary trump escalate racial taunt crowd chant send back send back ilhan omar congresswoman arrive us somalian child refugee house representatives early vote attempt impeach president motion bring forward blast trump racist remark aim four congresswoman colour democrats follow lead house speaker nancy pelosi say multiple investigation president associate activity allow play sun holiday shame british tourist responsibility come parliamentary scrutiny commons environmental audit committee say global tourism responsible 5 greenhouse gas emission cheap flight zero tax aviation fuel mean holiday business grow rapidly account 10 global gdp committee report back way reduce impact use incentive taxation offset great scrutiny travel company claim sustainability spacey case prosecutor drop charge actor kevin spacey grope young man massachusetts resort island bar 2016 accuser defence say contain text message support actor claim innocence man accuse spacey also drop civil lawsuit recently file actor seek damage severe permanent mental distress emotional injury sea mail british author 50year old message bottle wash south australian coast find 17 november 1969 paul gilmore 13year old english boy travel sitmar line ship fairstar bring many british migrant australia 1960 south australian man paul elliot son jyah tell australian broadcasting corporation radio find bottle eyre peninsula west coast recently fish thursday abc report track gilmore sister annie crossland say current location sea cruise baltic last time ship probably go australia cruise thing say hydration station location first 50 london new public water fountain announce instal week predominantly tube mainline train station shopping centre market recreation ground fountain attach main water supply feature distinctive design giant blue waterdrop make easy spot abbey wood station worship square hackney today focus podcast brexit save lib dems anti brexit stance liberal democrats see make extraordinary comeback 2019 observer political editor toby helm discusse oliver wainwright inclusion social housing year stirle prize lunchtime read vanish neighbourhood prague century old jewish quarter josefov demolish use dynamite 1896 exception religious site entire neighbourhood destroy black bottom detroit vibrant community john lee hooker della reese play club hastings street destroy replace chrysler freeway visitor shanghai late 19th century would find city dominate narrow wind lane shikuman equivalent britain victorian terrace worker housing today city struggle house 263 million resident many old neighbourhood target guardian cities chronicle sport open get way today 68year wait royal portrush potential prove rory mcilroy keen emphasise wide context major play northern ireland meanwhile rampa refuse condemn stage march orange hall chris froome officially name follow doping case involve juan jose cobo originally finish first place formula one reveal detail propose plan 2021 set officially confirm october liverpool play south africa next place netball world cup semi final already secure women ashes test begin taunton today england need victory keep alive hope series australia bowler megan schutt call red ball cricket become business pound could fall parity us dollar event deal brexit sterling sit 1243 today bank expert say could drift lower level last see 1980 uncertainty continue cloud british politic lack clarity us china trade talk dog global stock market asian share fall broadly overnight south korea central bank highlight alarm shrink demand country export industry cut rate 025 hope stimulate economy ftse100 see fall 026 later morning paper two paper lead today mirror metro go brother manchester bomber salman abedi extradite britain headline say bomber bro fly uk face justice back face british justice times telegraph agree boris johnson brandish packet kipper speech good picture  diverge top story former splash young driver face night ban latter say elderly face visit tv licence fee police guardian lead may swipe rancour hatred brexit absolutist express boris need get brexit october 31 ft lead vestager parting shot big tech aim amazon qualcomm mail scandal care bill divide sun lead story airline passenger bill ps85000 try storm cockpit allege air rage incident jumbo debt headline read sign guardian morning briefing deliver thousand inboxe bright early every weekday already receive email news,The Guardian (London)
Thursday briefing: Elizabeth Warren rips into Bloomberg;Most brutal Democratic debate yet ... 11 dead after Germany shisha bar attacks ... two Diamond Princess passengers die of Covid-19,Warren Murray,2020-02-20T00:00:00Z,U.S. Federal; International; Nevada; New Hampshire; New York,,News,1786, top story mogul attack woman police good morning warren murray dramatic night news michael bloomberg architect racist police policy indulge sexist comment silence aggrieve female employee elizabeth warren lead assault former new york mayor multi billionaire bloomberg stumble response series question stop frisk new york say embarrassed racially charge tactic apologise warren also challenge bloomberg release woman company non disclosure agreement sign settle lawsuit bloomberg defend record woman company lot lot woman big responsibility warren counter hope hear defence nice woman debate paris theater las vegas come one week sanders win new hampshire primary ahead primary nevada bloomberg compete observe guardian us team 11 die germany shooting least 11 people kill several seriously injure german town hanau 25 km east frankfurt accord local police nine people die attack two bar around 10 pm wednesday police say hunt launch perpetrator police say around 5 local time officer storm home alleged suspect find dead along another body police say confirm information background two attack appeal witness come forward hanau mp katja leikert call horrific scenario hanau mayor claus kaminsky lament bad evening imaginable come day one person shoot dead four injure outside berlin music venue host turkish comedy show coronavirus cruise death two old japanese covid19 virus accord report evacuation flight briton ship expect depart japan friday death toll china stand 2100 expert worldwide sign statement support chinese colleague attack social medium threaten violence false rumour circulate origin virus warning haranguing find treatment vaccine live blog men kill woman half woman kill man uk 2018 die hand current former partner accord fourth femicide census half case perpetrator previous history violence woman three find kill census say 149 woman kill 147 man 2018 10 previous year high number since census begin victim also case woman kill son stepson son law former son law 6 kill stranger karen ingala smith domestic violence charity nia say many die despite express fear police service friend family option find help due resource crisis service julie bindel write today feminist campaigner often ask woman still target male rage success significant high risk huawei bar huawei ps65 worth pilot 5 g project business community include flood warn scheme yorkshire coastal search rescue experiment dorset electric vehicle project involve ford vodafone none win project future project use equipment high risk vendor department digital culture media sport  say january government announce limit use chinese supplier equipment 5 g network roll across uk prevent get go rebecca long bailey would commit labour scrap anti extremism programme prevent elect party leader candidate say prevent programme alienate muslim community set back freedom make us safe evidence clear get go long bailey say would involve muslim leader labour member ballot party leadership contest friday worthy note new polymer go circulation bank england begin replace popular banknote country least two billion note print half country cash machine switch within next fortnight scotland bank scotland clydesdale bank launch polymer ps20 note 27 february royal bank scotland follow 5 march bank northern ireland also change 2020 date specify today focus podcast flood britain new normal series storm lash britain past two week result widespread flood leave resident business devastate climate heat town expand floodplain ask also today richard partington government plan britain new immigration rule lunchtime read modi way tear india apart seven decade india hold together constitution promise equality narendra modi bharatiya janata party remake nation one write samanth subramanian sport jose mourinho reach champions league quarter final insist team spirit give chance overcome selection crisis attack pep guardiola say confident club ability follow alleged breach uefa financial fair play regulation deontay wilder mental health battle fiery press conference readiness saturday kim clijsters taste defeat late tennis comeback former woman world 1 find formula one team mclaren attempt safeguard personnel coronavirus jemma reekie extraordinary start season continue yet another victory reign world champion halimah nakaayi lievin france rory mcilroy deliver may well prove state interest take part business world renowned devon base company provide carpet prestigious building us capitol washington collapse possible loss 80 job ftse100 set dip 025 opening morning pound 129  1196 paper guardian move flood coverage along new home fact since 2003 one 10 potentially leave ten thousand people great danger extreme winter storm one expert prof robert wilby university loughborough argue government review housebuilding target compound exist risk continue build floodplain mirror heroes zero paper contrast flood rescuer feat boris johnson failure visit affected area stay conservatives border control plan immigration backlash british carer say issue priti patel claim untapped workforce 85 million actually carer student sick retire metro repeat patel claim 8 brits fill low skill job gap though subheade point actually secretary state also come fire times home office war staff accuse bully patel say war permanent secretary mail celebrate house price surge britain  claim evidence boris bounce ofsted fear school squander extra cash telegraph cover new controversy chief inspector amanda spielman say school budgeting procedure tighten share ps14bn funding boost express join battle new wonder drug save life call tritafka hold promise treat cystic fibrosis ft sound like good idea eu aim loosen big tech grip force group share datum like amazon google enjoy near monopoly would open database small competitor sign guardian morning briefing deliver thousand inboxe bright early every weekday already receive email news,The Guardian (London)
Thursday Express: Hedge fund shutting; new digital money rules coming,Maricor Zapata,2020-02-13T00:00:00Z,U.S. Federal; Iowa; New Jersey; Texas,,News,611,amid struggle hedge fund industry former citigroup head currency anil prasad shut silver ridge asset management set upon leave citigroup 2014 financial times report big deal far heartland financial planned purchase levelland texas base aim bancshares tend tilt dubuque iowa base company west executive chairman lynn fuller say heartland financial aim rough geographic balance acquisition fuel growth strategy fidelity national information services also expect release financial result recent quarter today house financial services committee release report show lack workforce diversity america large bank lawmaker consider suite bill would require bank disclose diversity makeup staff consider invest minority woman asset manager jpmorgan face new class lawsuit new orleans federal court alleged discriminatory practice black personal banker give low pay reduce chance advancement assignment less perform branch also risk physical harm shareholder activist group focus climate issue jpmorgan say receive notification company seek omit proposal 2020 proxy regulator effort update community reinvestment act ongoing process federal reserve chairman jerome powell tell senate banking committee february 12 say far ease fed stance learn public comment agency proposal federal reserve plan deliver fednow central bank real time payment system market stage initially 2023 2024 incremental refinement come future american banker report cite boston fed vice president kenneth montgomery oversee project wells fargo longer require arbitration employee involve future sexual harassment claim new jersey jury order pnc financial services pay former employee damara scott 24 million allegedly fail protect sexually harass client patrick pignatello american banker report pignatello however reportedly die shortly suit file 2013 case could bring trial goldman sachs race big tech company like amazon microsoft google facebook hire technical staff boast 10000 developer make quarter investment bank total workforce cnbc report cite interview george lee bank co chief information officer goldman sachs line prince harry guest speaker online interview series talk gs someone knowledge matter tell cnbc treasury secretary steven mnuchin tell senate finance committee hear february 12 soon announce new rule cryptocurrency digital payment system improve transparency keep digital money use secret bank account bloomberg news report insurance front arch capital group executive see strengthen price condition property casualty market believe yet become hard market daily dose express edition update 630 et external link may require subscription link current publication time responsible link unavailable later,SNL Financial Extra
Thursday in Parliament - 01:45 AM GMT,,2018-09-07T00:00:00Z,International,,News,595,speech text transcript1this copy computer generate text vary accuracy due speaker dialect audio quality issuesi time public interest national interest robert mueller style enquiry conduct eu referendum also examine role play russian state raise serious issue doubt law stand date ico much increase power encourage use doubt serious matter concern european referendum investigate matter department tom watson later take case social medium giant accountable problem seem government whole either unwilling unable deal market dominance big tech giant side house believe company run ring around government legislator regulator reasonably example mark zuckerberg refuse appear select committee even rupert murdoch time right new single powerful regulator take big tech giant redres imbalance market power aspect mention range line hub expect assistance range area need think tech economy change dramatically tech company power change dramatically whatever action government country take think substantially attack secondly hope example world think properly design carefully robust scrutiny jeremy wright minister tell come creative alternative london night crime epidemic include ban offence social medium offender police log nearly 1300 knife attack mp sarah jones say harsh sentence work 40 2010 almost 70 today get last five year knife crime shocking increase suggest harsh sentence simply answer look two thing creative alternative prison ban young people social medium ease incite violence secondly education rehabilitation keep young people prison system know honourable lady key interest issue think direct correlation see rise knife crime right approach issue possession seriously take board point causation deeply impressed work young people intervention early stage help know government look hospital admission fall 12 year let us policy include glasgow excellent example last month speak scottish law officer experience deeply interested mps spend afternoon debate entitle global britain uk place new world old structure long exist need clear need assessment place,TVEyes - BBC News 24
Thursday in Parliament - 10:11 PM GMT,,2018-09-06T00:00:00Z,U.S. Federal; International,,News,832,speech text transcript1this copy computer generate text vary accuracy due speaker dialect audio quality issuesthe committee concerned pupil special educational need school exclude without even try meet need meet need impact school progress 8 pupils whose result may negatively different school score encourage move move internal exclusion victim bullying infringement uniform policy pupil exclude minor concerned pupil parent hasty decision lack vulnerable poor choice knowledge option school exclude pupil clear say include pupil violent say school must safety school dangerous pose threat inclusive say school support child additional need without try rol exclude meet need say real weakness alternative provision child alternative provision deserve teach inspirational teacher many see poor relation often alternative provision experience alternative think trainee teacher set mainstream school provision special school provision school buddy alternative training share expertise experience state fund school point provide keep educate get child seem blossom quite idea roll child couple year dramatically last evidence committee minister giving illegal unlawful say process roling bring abrupt end also ensure process sure youngster get actually make get real opportunity euphemistically home educate palm good quite frankly home education go rare growth education sustain call home educational process number child exclude county norfolk shockingly high put waiting often child exclude unit full list provision member indicate child know honourable child special disadvantaged background mental ill health educational need child experience adversity also disproportionately affect life various form really vital change propensity exclude country way operate need learn example good practice succeed use school seem exclusion first resort rather last resort seem become first resort parliament watch thursday alicia mccarthy forget find previous addition programme via bbci player labour call investigation russian interference eu referendum tom watson demand us style party deputy leader investigation involve security service ask mueller style culture question investigation base russian link donald trump fbi investigation presidential campaign illegal illegal datum breach facebook break law allow eu referendum minister allude numerous investigation multiple regulator police authority time public interest national interest us style inquiry conduct eu referendum also examine role play russian state right honourable gentleman raise serious issue doubt law stand update ico much increase power encourage use doubt serious matter concern european referendum investigate really matter department tom watson later take case social new culture secretary medium giant accountable government whole either problem seem unwilling unable deal market dominance big tech giant side house believe company run ring around government legislator regulator well example mark zuckerberg cowardly refuse,TVEyes - BBC Parliament
Thursday in Parliament - 10:16 PM GMT,,2018-09-06T00:00:00Z,International,,News,886,speech text transcript1this copy computer generate text vary accuracy due speaker dialect audio quality issuesto appear dcms select committee even rupert murdoch secretary state agree time right new single powerful regulator take big tech giant redres huge imbalance market power well mr speaker aspect right onto bill johnson mention know share concern range online hub think realistically expect expect assistance tech company currently whole range area need think truth tech economy change dramatically online company power change dramatically understand want make sure whatever action government country take properly drop two reason substantially attack properly think secondly example world think properly design carefully robust scrutiny reassurance exactly process intend engage jeremy wright minister tell come creative alternative include ban offender london knife crime epidemic social medium labour say crime rate capital rise log nearly 1300 knife year metropolitan police attack labour mp sarah jones tell commons harsh sentence simply work custodial sentence nice proportion people receive possession rise 40 2010 almost 70 today yet last five year knife crime sustained shocking increase suggest harsh sentence simply answer attorney general look two thing one creative alternative present electronic tagging ban young people social medium use incite violence secondly way reduce reoffende education rehabilitation keep young people prison system thank honourable lady question know keen local interest issue affect croydon much part country would say think direct correlation see rise knife crime since early 2016 think right approach issue possession serious way take board point causation recently visit trust upland know familiar deeply impressed work young people sort intervention approach early stage think help deal problem current knife crime epidemic england wales 53 three year government mets look scottish government glasgow hospital admission splash stab wound fall 65 12 year update house policy enact glasgow replicate london widely follow delegation glasgow honourable gentleman right raise glasgow example make plan visit glasgow soon possible early last month speak scottish law office experience happen deeply interested want learn quickly possible mps spend afternoon debate entitle global britain affairs committee tell mp chair foreign uk place old new world structure long exist assessment place need really clear need world need clear go maximise position future mean understanding understanding want real choice mr deputy speaker either choose shape event shape mr deputy speaker tell clearly though many people today believe devil believe evil war come back europe believe danger undermining international system believe many way rule somewhat optional truth simply tell see cost baghdad middle class home wealthy area people live civilized society 60 50 kabul see family photo people show daughter go university miniskirt live reality islamic fundamentalism barbarity war say clearly sir believe double mean,TVEyes - BBC Parliament
